_uri,id,_date,_song,_artist,_peak-rank,_weeks-on-board,_genres,_track,_uri.1,year,keywords
4aX4Oycsk1fhHIee1zqsDe,How_To_Love_by_Lil_Wayne,2011-06-11,How To Love,Lil Wayne,5,24,"['as jailed', 'chopped and screwed', 'contemporary r&b', 'criminal', 'gangsta rap', 'hip hop', 'hip hop rnb and dance hall', 'lil wayne', 'pop rap', 'r&b', 'rap', 'rap rock', 'relic inn', 'southern hip hop', 'trap']",How To Love,4aX4Oycsk1fhHIee1zqsDe,2011,"as jailed, chopped and screwed, contemporary r&b, criminal, gangsta rap, hip hop, hip hop rnb and dance hall, lil wayne, pop rap, r&b, rap, rap rock, relic inn, southern hip hop, trap"
2U8g9wVcUu9wsg6i7sFSv8,Every_Teardrop_Is_A_Waterfall_by_Coldplay,2011-06-18,Every Teardrop Is A Waterfall,Coldplay,14,18,"['alternative rock', 'ambient pop', 'britannique', 'british', 'britpop', 'chapel', 'english', 'parlophone', 'piano pop', 'piano rock', 'pop', 'pop rock', 'pop/rock', 'post-britpop', 'rock', 'rock and indie', 'uk']",Every Teardrop Is A Waterfall,2U8g9wVcUu9wsg6i7sFSv8,2011,"alternative rock, ambient pop, britannique, british, britpop, chapel, english, parlophone, piano pop, piano rock, pop, pop rock, pop/rock, post-britpop, rock, rock and indie, uk"
62zFEHfAYl5kdHYOivj4BC,International_Love_by_Pitbull_Featuring_Chris_Brown,2011-06-18,International Love,Pitbull Featuring Chris Brown,13,26,"['dance', 'dance-pop', 'electro house', 'electropop', 'eurodance', 'global warming meltdown', 'hip hop', 'hip house', 'hiphop', 'latin', 'latin pop', 'maltido', 'pitbull', 'pop rap', 'southern hip hop']",International Love,62zFEHfAYl5kdHYOivj4BC,2011,"dance, dance-pop, electro house, electropop, eurodance, global warming meltdown, hip hop, hip house, hiphop, latin, latin pop, maltido, pitbull, pop rap, southern hip hop"
5zpDHEU12zATwLGvozxPw2,Lighters_by_Bad_Meets_Evil_Featuring_Bruno_Mars,2011-07-02,Lighters,Bad Meets Evil Featuring Bruno Mars,4,22,"['hardcore hip hop', 'hip hop', 'hip-hop']",Lighters,5zpDHEU12zATwLGvozxPw2,2011,"hardcore hip hop, hip hop, hip-hop"
0qOnSQQF0yzuPWsXrQ9paz,Stereo_Hearts_by_Gym_Class_Heroes_Featuring_Adam_Levine,2011-07-02,Stereo Hearts,Gym Class Heroes Featuring Adam Levine,4,37,"['dance-pop', 'hip hop', 'pop and chart', 'pop rap']",Stereo Hearts,0qOnSQQF0yzuPWsXrQ9paz,2011,"dance-pop, hip hop, pop and chart, pop rap"
2Q8e05RXzTkyiriNlW5ss5,Moves_Like_Jagger_by_Maroon_5_Featuring_Christina_Aguilera,2011-07-09,Moves Like Jagger,Maroon 5 Featuring Christina Aguilera,1,49,"['adult contemporary', 'automod ng', 'dance', 'dance-pop', 'electropop', 'fixme label mess', 'funk rock', 'music for soccer moms', 'pop', 'pop rock', 'pop/rock', 'rock', 'rock and indie', 'slow pop']",Moves Like Jagger,2Q8e05RXzTkyiriNlW5ss5,2011,"adult contemporary, automod ng, dance, dance-pop, electropop, fixme label mess, funk rock, music for soccer moms, pop, pop rock, pop/rock, rock, rock and indie, slow pop"
2KFCQ4NIGaWyc2zL04gf95,Skyscraper_by_Demi_Lovato,2011-07-30,Skyscraper,Demi Lovato,10,15,"['alien lives matter', 'dance-pop', 'electropop', 'pop', 'pop rock', 'synthpop', 'teen pop']",Skyscraper,2KFCQ4NIGaWyc2zL04gf95,2011,"alien lives matter, dance-pop, electropop, pop, pop rock, synthpop, teen pop"
1pbHy9VBpSyZh56xuujZz0,In_The_Dark_by_Dev,2011-08-20,In The Dark,Dev,11,20,"['dance', 'electropop', 'hip hop', 'house']",In The Dark,1pbHy9VBpSyZh56xuujZz0,2011,"dance, electropop, hip hop, house"
6LxSe8YmdPxy095Ux6znaQ,Headlines_by_Drake,2011-08-27,Headlines,Drake,13,25,"['alternative r&b', 'contemporary r&b', 'cotm candidate', 'hardcore hip', 'hip hop', 'lesbian', 'luxury rap', 'pop rap', 'r&b', 'rap', 'rap us', 'rapper', 'relic inn', 'trap', 'trap rap']",Headlines,6LxSe8YmdPxy095Ux6znaQ,2011,"alternative r&b, contemporary r&b, cotm candidate, hardcore hip, hip hop, lesbian, luxury rap, pop rap, r&b, rap, rap us, rapper, relic inn, trap, trap rap"
77TT8Xvx637TpzV8kKGkUw,Titanium_by_David_Guetta_Featuring_Sia,2011-08-27,Titanium,David Guetta Featuring Sia,7,33,"['dance', 'dance and electronica', 'dance-pop', 'electro house', 'electronic', 'electropop', 'english', 'eurodance', 'french house', 'house', 'progressive house', 'seen live']",Titanium,77TT8Xvx637TpzV8kKGkUw,2011,"dance, dance and electronica, dance-pop, electro house, electronic, electropop, english, eurodance, french house, house, progressive house, seen live"
3FFcZZq3Z3EJrhUecwcMdG,She_Will_by_Lil_Wayne_Featuring_Drake,2011-09-03,She Will,Lil Wayne Featuring Drake,3,21,"['as jailed', 'chopped and screwed', 'contemporary r&b', 'criminal', 'gangsta rap', 'hip hop', 'hip hop rnb and dance hall', 'lil wayne', 'pop rap', 'r&b', 'rap', 'rap rock', 'relic inn', 'southern hip hop', 'trap']",She Will,3FFcZZq3Z3EJrhUecwcMdG,2011,"as jailed, chopped and screwed, contemporary r&b, criminal, gangsta rap, hip hop, hip hop rnb and dance hall, lil wayne, pop rap, r&b, rap, rap rock, relic inn, southern hip hop, trap"
1tAutlhI9FwnKn7fVgmd5P,Without_You_by_David_Guetta_Featuring_Usher,2011-09-17,Without You,David Guetta Featuring Usher,4,30,"['dance', 'dance and electronica', 'dance-pop', 'electro house', 'electronic', 'electropop', 'english', 'eurodance', 'french house', 'house', 'progressive house', 'seen live']",Without You,1tAutlhI9FwnKn7fVgmd5P,2011,"dance, dance and electronica, dance-pop, electro house, electronic, electropop, english, eurodance, french house, house, progressive house, seen live"
2LEF1A8DOZ9wRYikWgVlZ8,Good_Feeling_by_Flo_Rida,2011-09-17,Good Feeling,Flo Rida,3,37,"['a filk artist', 'dance-pop', 'electro', 'electropop', 'hip hop', 'hip hop rnb and dance hall', 'hip house', 'pop rap', 'southern hip hop']",Good Feeling,2LEF1A8DOZ9wRYikWgVlZ8,2011,"a filk artist, dance-pop, electro, electropop, hip hop, hip hop rnb and dance hall, hip house, pop rap, southern hip hop"
0obBFrPYkSoBJbvHfUIhkv,Sexy_And_I_Know_It_by_LMFAO,2011-09-17,Sexy And I Know It,LMFAO,1,42,"['awesomename', 'comedy rap', 'dance', 'dance-pop', 'dupe recordings 2013', 'electro', 'electro house', 'electronic', 'electropop', 'pop', 'pop rap']",Sexy And I Know It,0obBFrPYkSoBJbvHfUIhkv,2011,"awesomename, comedy rap, dance, dance-pop, dupe recordings 2013, electro, electro house, electronic, electropop, pop, pop rap"
6nek1Nin9q48AVZcWs9e9D,Paradise_by_Coldplay,2011-10-01,Paradise,Coldplay,15,32,"['alternative rock', 'ambient pop', 'britannique', 'british', 'britpop', 'chapel', 'english', 'parlophone', 'piano pop', 'piano rock', 'pop', 'pop rock', 'pop/rock', 'post-britpop', 'rock', 'rock and indie', 'uk']",Paradise,6nek1Nin9q48AVZcWs9e9D,2011,"alternative rock, ambient pop, britannique, british, britpop, chapel, english, parlophone, piano pop, piano rock, pop, pop rock, pop/rock, post-britpop, rock, rock and indie, uk"
6qn9YLKt13AGvpq9jfO8py,We_Found_Love_by_Rihanna_Featuring_Calvin_Harris,2011-10-08,We Found Love,Rihanna Featuring Calvin Harris,1,41,"['barbade', 'barbadian', 'barbadien', 'barbados', 'contemporary r b', 'contemporary r&b', 'dance', 'dance-pop', 'dancehall', 'electro house', 'electropop', 'hip hop', 'pop', 'pop and chart', 'pop soul', 'r&b', 'reggae', 'rehab', 'rihanna', 'rnb']",We Found Love,6qn9YLKt13AGvpq9jfO8py,2011,"barbade, barbadian, barbadien, barbados, contemporary r b, contemporary r&b, dance, dance-pop, dancehall, electro house, electropop, hip hop, pop, pop and chart, pop soul, r&b, reggae, rehab, rihanna, rnb"
0RUGuh2uSNFJpGMSsD1F5C,It_Will_Rain_by_Bruno_Mars,2011-10-15,It Will Rain,Bruno Mars,3,29,"['a filk artist', 'contemporary r&b', 'funk', 'music for soccer moms', 'new wave', 'pop', 'pop rock', 'pop soul', 'r&b', 'relic inn', 'rock', 'soul', 'synth funk']",It Will Rain,0RUGuh2uSNFJpGMSsD1F5C,2011,"a filk artist, contemporary r&b, funk, music for soccer moms, new wave, pop, pop rock, pop soul, r&b, relic inn, rock, soul, synth funk"
3oL3XRtkP1WVbMxf7dtTdu,The_One_That_Got_Away_by_Katy_Perry,2011-10-29,The One That Got Away,Katy Perry,3,24,"['""ur so fail""', 'also fail', 'american', 'américain', 'bubblegum', 'california gurls', 'chesty', 'cute', 'dance-pop', 'disco', 'electropop', 'fail', 'failfail', 'gaaaaaayyyyyyyyy', 'gaymeme', 'her expression is like shes thinking something dumb', 'homophobe', 'house', ""i'm gay if i am shut up"", ""i'm gay if i am⸲ shut up"", 'katy perry', 'katy perry is gay', 'katy pery is dumb', 'lame', 'lame lame lame lame', 'lolol trap?', 'megafail', 'megalmaestupiddumb', 'multiple ipi', 'nope still fail', 'pop', 'pop rock', 'rock', ""srsly i'm gay if i am shut up"", ""srsly what's wrong with beign gay"", 'still fail', 'total fail', 'trap', 'uncool', 'united states', 'ur so faaaail', 'ur so fail', 'ur so lame', 'usa', ""what's wrong with being gay? gay"", '‟ur so fail”']",The One That Got Away,3oL3XRtkP1WVbMxf7dtTdu,2011,"""ur so fail"", also fail, american, américain, bubblegum, california gurls, chesty, cute, dance-pop, disco, electropop, fail, failfail, gaaaaaayyyyyyyyy, gaymeme, her expression is like shes thinking something dumb, homophobe, house, ""im gay if i am shut up"", ""im gay if i am⸲ shut up"", katy perry, katy perry is gay, katy pery is dumb, lame, lame lame lame lame, lolol trap?, megafail, megalmaestupiddumb, multiple ipi, nope still fail, pop, pop rock, rock, ""srsly im gay if i am shut up"", ""srsly whats wrong with beign gay"", still fail, total fail, trap, uncool, united states, ur so faaaail, ur so fail, ur so lame, usa, ""whats wrong with being gay? gay"", ‟ur so fail”"
6MAdEUilV2p9RQUqE5bMAK,Domino_by_Jessie_J,2011-10-29,Domino,Jessie J,6,29,"['pop', 'r&b', 'soul']",Domino,6MAdEUilV2p9RQUqE5bMAK,2011,"pop, r&b, soul"
7xapw9Oy21WpfEcib2ErSA,Mistletoe_by_Justin_Bieber,2011-11-05,Mistletoe,Justin Bieber,11,12,"['amazing', 'awful', 'black metal', 'christmas music', 'contemporary r&b', 'dance-pop', 'electropop', 'english', 'gay', 'pop', 'teen pop', 'terrible', 'tropical house']",Mistletoe,7xapw9Oy21WpfEcib2ErSA,2011,"amazing, awful, black metal, christmas music, contemporary r&b, dance-pop, electropop, english, gay, pop, teen pop, terrible, tropical house"
4YKAOXyqkKZ5gOZR0AmVMN,Red_Solo_Cup_by_Toby_Keith,2011-11-12,Red Solo Cup,Toby Keith,15,20,"['2008 universal fire victim', 'contemporary country', 'country', 'country pop', 'pop', 'rock']",Red Solo Cup,4YKAOXyqkKZ5gOZR0AmVMN,2011,"2008 universal fire victim, contemporary country, country, country pop, pop, rock"
1EQn3Uc5AyUXoiPLeyCrrg,Ours_by_Taylor_Swift,2011-11-26,Ours,Taylor Swift,13,20,"['americana', 'contemporary country', 'country', 'country pop', 'country-pop', 'dance-pop', 'electropop', 'female vocals', 'fixme label mess', 'hp', 'icon', 'pop', 'pop rock', 'relic inn', 'singer-songwriter', 'singer/songwriter', 'taylor-swift', 'teen pop', 'top 40']",Ours,1EQn3Uc5AyUXoiPLeyCrrg,2011,"americana, contemporary country, country, country pop, country-pop, dance-pop, electropop, female vocals, fixme label mess, hp, icon, pop, pop rock, relic inn, singer-songwriter, singer/songwriter, taylor-swift, teen pop, top 40"
0vvt4IZOMkRug195S4MUq0,If_This_Was_A_Movie_by_Taylor_Swift,2011-11-26,If This Was A Movie,Taylor Swift,10,2,"['americana', 'contemporary country', 'country', 'country pop', 'country-pop', 'dance-pop', 'electropop', 'female vocals', 'fixme label mess', 'hp', 'icon', 'pop', 'pop rock', 'relic inn', 'singer-songwriter', 'singer/songwriter', 'taylor-swift', 'teen pop', 'top 40']",If This Was A Movie,0vvt4IZOMkRug195S4MUq0,2011,"americana, contemporary country, country, country pop, country-pop, dance-pop, electropop, female vocals, fixme label mess, hp, icon, pop, pop rock, relic inn, singer-songwriter, singer/songwriter, taylor-swift, teen pop, top 40"
3Yt9lRtS5V4nbJnwcgFgvC,You_Da_One_by_Rihanna,2011-11-26,You Da One,Rihanna,14,20,"['barbade', 'barbadian', 'barbadien', 'barbados', 'contemporary r b', 'contemporary r&b', 'dance', 'dance-pop', 'dancehall', 'electro house', 'electropop', 'hip hop', 'pop', 'pop and chart', 'pop soul', 'r&b', 'reggae', 'rehab', 'rihanna', 'rnb']",You Da One,3Yt9lRtS5V4nbJnwcgFgvC,2011,"barbade, barbadian, barbadien, barbados, contemporary r b, contemporary r&b, dance, dance-pop, dancehall, electro house, electropop, hip hop, pop, pop and chart, pop soul, r&b, reggae, rehab, rihanna, rnb"
047fCsbO4NdmwCBn8pcUXl,Take_Care_by_Drake_Featuring_Rihanna,2011-12-03,Take Care,Drake Featuring Rihanna,7,34,"['barbade', 'barbadian', 'barbadien', 'barbados', 'contemporary r b', 'contemporary r&b', 'dance', 'dance-pop', 'dancehall', 'electro house', 'electropop', 'hip hop', 'pop', 'pop and chart', 'pop soul', 'r&b', 'reggae', 'rehab', 'rihanna', 'rnb']",Take Care,047fCsbO4NdmwCBn8pcUXl,2011,"barbade, barbadian, barbadien, barbados, contemporary r b, contemporary r&b, dance, dance-pop, dancehall, electro house, electropop, hip hop, pop, pop and chart, pop soul, r&b, reggae, rehab, rihanna, rnb"
4Kz4RdRCceaA9VgTqBhBfa,The_Motto_by_Drake_Featuring_Lil_Wayne,2011-12-03,The Motto,Drake Featuring Lil Wayne,14,35,"['as jailed', 'chopped and screwed', 'contemporary r&b', 'criminal', 'gangsta rap', 'hip hop', 'hip hop rnb and dance hall', 'lil wayne', 'pop rap', 'r&b', 'rap', 'rap rock', 'relic inn', 'southern hip hop', 'trap']",The Motto,4Kz4RdRCceaA9VgTqBhBfa,2011,"as jailed, chopped and screwed, contemporary r&b, criminal, gangsta rap, hip hop, hip hop rnb and dance hall, lil wayne, pop rap, r&b, rap, rap rock, relic inn, southern hip hop, trap"
0srwKuJPH8yBzzFUJMBQM2,Rack_City_by_Tyga,2011-12-10,Rack City,Tyga,7,25,"['hip hop', 'pop rap', 'rap', 'rap us']",Rack City,0srwKuJPH8yBzzFUJMBQM2,2011,"hip hop, pop rap, rap, rap us"
5WQQIDU3HRaMyPkob8mpFb,Where_Have_You_Been_by_Rihanna,2011-12-10,Where Have You Been,Rihanna,5,26,"['barbade', 'barbadian', 'barbadien', 'barbados', 'contemporary r b', 'contemporary r&b', 'dance', 'dance-pop', 'dancehall', 'electro house', 'electropop', 'hip hop', 'pop', 'pop and chart', 'pop soul', 'r&b', 'reggae', 'rehab', 'rihanna', 'rnb']",Where Have You Been,5WQQIDU3HRaMyPkob8mpFb,2011,"barbade, barbadian, barbadien, barbados, contemporary r b, contemporary r&b, dance, dance-pop, dancehall, electro house, electropop, hip hop, pop, pop and chart, pop soul, r&b, reggae, rehab, rihanna, rnb"
1zugfOhn6BebboqGcpUlba,We_Are_Young_by_Glee_Cast,2011-12-24,We Are Young,Glee Cast,12,3,"['bogus artist', 'fixme', 'needs disambiguation/annotation', 'pop']",We Are Young,1zugfOhn6BebboqGcpUlba,2011,"bogus artist, fixme, needs disambiguation/annotation, pop"
3bfqkspKABT4pPicm6wC9F,Ass_Back_Home_by_Gym_Class_Heroes_Featuring_Neon_Hitch,2011-12-31,Ass Back Home,Gym Class Heroes Featuring Neon Hitch,12,23,"['dance-pop', 'hip hop', 'pop and chart', 'pop rap']",Ass Back Home,3bfqkspKABT4pPicm6wC9F,2011,"dance-pop, hip hop, pop and chart, pop rap"
1NpW5kyvO4XrNJ3rnfcNy3,Wild_Ones_by_Flo_Rida_Featuring_Sia,2012-01-07,Wild Ones,Flo Rida Featuring Sia,5,36,"['a filk artist', 'dance-pop', 'electro', 'electropop', 'hip hop', 'hip hop rnb and dance hall', 'hip house', 'pop rap', 'southern hip hop']",Wild Ones,1NpW5kyvO4XrNJ3rnfcNy3,2012,"a filk artist, dance-pop, electro, electropop, hip hop, hip hop rnb and dance hall, hip house, pop rap, southern hip hop"
4wCmqSrbyCgxEXROQE6vtV,Somebody_That_I_Used_To_Know_by_Gotye_Featuring_Kimbra,2012-01-21,Somebody That I Used To Know,Gotye Featuring Kimbra,1,59,"['art pop', 'indie pop', 'new zealand']",Somebody That I Used To Know,4wCmqSrbyCgxEXROQE6vtV,2012,"art pop, indie pop, new zealand"
3AGOgQzp0YcPH41u9p7dOp,Glad_You_Came_by_The_Wanted,2012-01-28,Glad You Came,The Wanted,3,37,"['boy band', 'dance-pop', 'electropop', 'pop', 'synthpop']",Glad You Came,3AGOgQzp0YcPH41u9p7dOp,2012,"boy band, dance-pop, electropop, pop, synthpop"
0KAiuUOrLTIkzkpfpn9jb9,Drive_By_by_Train,2012-01-28,Drive By,Train,10,36,"['alternative', 'alternative rock', 'classic pop and rock', 'music for soccer moms', 'piano rock', 'pop', 'pop rock', 'rock']",Drive By,0KAiuUOrLTIkzkpfpn9jb9,2012,"alternative, alternative rock, classic pop and rock, music for soccer moms, piano rock, pop, pop rock, rock"
1gihuPhrLraKYrJMAEONyc,Feel_So_Close_by_Calvin_Harris,2012-02-25,Feel So Close,Calvin Harris,12,26,"['complextro', 'contemporary r&b', 'dance', 'dance and electronica', 'dance-pop', 'disco', 'electro house', 'electro-disco', 'electronic', 'electropop', 'hip house', 'house', 'ibiza trance', 'nu-disco', 'progressive house', 'uk hip hop']",Feel So Close,1gihuPhrLraKYrJMAEONyc,2012,"complextro, contemporary r&b, dance, dance and electronica, dance-pop, disco, electro house, electro-disco, electronic, electropop, hip house, house, ibiza trance, nu-disco, progressive house, uk hip hop"
4cluDES4hQEUhmXj6TXkSo,What_Makes_You_Beautiful_by_One_Direction,2012-03-03,What Makes You Beautiful,One Direction,4,34,"['boy band', 'dance-pop', 'folk pop', 'pop', 'pop rock', 'power pop']",What Makes You Beautiful,4cluDES4hQEUhmXj6TXkSo,2012,"boy band, dance-pop, folk pop, pop, pop rock, power pop"
1nZzRJbFvCEct3uzu04ZoL,Part_Of_Me_by_Katy_Perry,2012-03-03,Part Of Me,Katy Perry,1,22,"['""ur so fail""', 'also fail', 'american', 'américain', 'bubblegum', 'california gurls', 'chesty', 'cute', 'dance-pop', 'disco', 'electropop', 'fail', 'failfail', 'gaaaaaayyyyyyyyy', 'gaymeme', 'her expression is like shes thinking something dumb', 'homophobe', 'house', ""i'm gay if i am shut up"", ""i'm gay if i am⸲ shut up"", 'katy perry', 'katy perry is gay', 'katy pery is dumb', 'lame', 'lame lame lame lame', 'lolol trap?', 'megafail', 'megalmaestupiddumb', 'multiple ipi', 'nope still fail', 'pop', 'pop rock', 'rock', ""srsly i'm gay if i am shut up"", ""srsly what's wrong with beign gay"", 'still fail', 'total fail', 'trap', 'uncool', 'united states', 'ur so faaaail', 'ur so fail', 'ur so lame', 'usa', ""what's wrong with being gay? gay"", '‟ur so fail”']",Part Of Me,1nZzRJbFvCEct3uzu04ZoL,2012,"""ur so fail"", also fail, american, américain, bubblegum, california gurls, chesty, cute, dance-pop, disco, electropop, fail, failfail, gaaaaaayyyyyyyyy, gaymeme, her expression is like shes thinking something dumb, homophobe, house, ""im gay if i am shut up"", ""im gay if i am⸲ shut up"", katy perry, katy perry is gay, katy pery is dumb, lame, lame lame lame lame, lolol trap?, megafail, megalmaestupiddumb, multiple ipi, nope still fail, pop, pop rock, rock, ""srsly im gay if i am shut up"", ""srsly whats wrong with beign gay"", still fail, total fail, trap, uncool, united states, ur so faaaail, ur so fail, ur so lame, usa, ""whats wrong with being gay? gay"", ‟ur so fail”"
1RMRkCn07y2xtBip9DzwmC,Turn_Up_The_Music_by_Chris_Brown,2012-03-03,Turn Up The Music,Chris Brown,10,20,"['_blacklist', 'abuser', 'american', 'anti vax', 'contemporary r&b', 'dance', 'dance-pop', 'electro house', 'electropop', 'hip hop', 'hip hop rnb and dance hall', 'hip-hop', 'misogynist', 'pop', 'pop rap', 'r&b', 'relic inn', 'rnb', 'wifebeater', ""ya man ain't me (produced by the.mp3""]",Turn Up The Music,1RMRkCn07y2xtBip9DzwmC,2012,"_blacklist, abuser, american, anti vax, contemporary r&b, dance, dance-pop, electro house, electropop, hip hop, hip hop rnb and dance hall, hip-hop, misogynist, pop, pop rap, r&b, relic inn, rnb, wifebeater, ""ya man aint me (produced by the.mp3"""
3TGRqZ0a2l1LRblBkJoaDx,Call_Me_Maybe_by_Carly_Rae_Jepsen,2012-03-10,Call Me Maybe,Carly Rae Jepsen,1,50,"['chillwave', 'dance-pop', 'electropop', 'pop', 'synthpop', 'teen pop']",Call Me Maybe,3TGRqZ0a2l1LRblBkJoaDx,2012,"chillwave, dance-pop, electropop, pop, synthpop, teen pop"
2iUmqdfGZcHIhS3b9E9EWq,Everybody_Talks_by_Neon_Trees,2012-03-31,Everybody Talks,Neon Trees,6,39,"['indie', 'provo', 'utah']",Everybody Talks,2iUmqdfGZcHIhS3b9E9EWq,2012,"indie, provo, utah"
4sK96UnGx3NjBaqvfTG2dm,Too_Close_by_Alex_Clare,2012-04-07,Too Close,Alex Clare,7,44,"['alternative rock', 'best', 'dubstep', 'electronic', 'soul']",Too Close,4sK96UnGx3NjBaqvfTG2dm,2012,"alternative rock, best, dubstep, electronic, soul"
0171XsIM2xyeXRr6wsugEI,Boyfriend_by_Justin_Bieber,2012-04-14,Boyfriend,Justin Bieber,2,20,"['amazing', 'awful', 'black metal', 'christmas music', 'contemporary r&b', 'dance-pop', 'electropop', 'english', 'gay', 'pop', 'teen pop', 'terrible', 'tropical house']",Boyfriend,0171XsIM2xyeXRr6wsugEI,2012,"amazing, awful, black metal, christmas music, contemporary r&b, dance-pop, electropop, english, gay, pop, teen pop, terrible, tropical house"
3eQlGeyuSibgAGPEJugaDW,Back_In_Time_by_Pitbull,2012-04-14,Back In Time,Pitbull,11,20,"['dance', 'dance-pop', 'electro house', 'electropop', 'eurodance', 'global warming meltdown', 'hip hop', 'hip house', 'hiphop', 'latin', 'latin pop', 'maltido', 'pitbull', 'pop rap', 'southern hip hop']",Back In Time,3eQlGeyuSibgAGPEJugaDW,2012,"dance, dance-pop, electro house, electropop, eurodance, global warming meltdown, hip hop, hip house, hiphop, latin, latin pop, maltido, pitbull, pop rap, southern hip hop"
1LmN9SSHISbtp9LoaR5ZVJ,Payphone_by_Maroon_5_Featuring_Wiz_Khalifa,2012-05-05,Payphone,Maroon 5 Featuring Wiz Khalifa,2,31,"['hip hop', 'hip hop rnb and dance hall', 'pop rap', 'rap']",Payphone,1LmN9SSHISbtp9LoaR5ZVJ,2012,"hip hop, hip hop rnb and dance hall, pop rap, rap"
3bC1ahPIYt1btJzSSEyyrF,Whistle_by_Flo_Rida,2012-05-12,Whistle,Flo Rida,1,29,"['a filk artist', 'dance-pop', 'electro', 'electropop', 'hip hop', 'hip hop rnb and dance hall', 'hip house', 'pop rap', 'southern hip hop']",Whistle,3bC1ahPIYt1btJzSSEyyrF,2012,"a filk artist, dance-pop, electro, electropop, hip hop, hip hop rnb and dance hall, hip house, pop rap, southern hip hop"
12eMQUn2GzfsfsQLH53M19,Scream_by_Usher,2012-05-12,Scream,Usher,9,21,"['contemporary r&b', 'hip hop rnb and dance hall', 'pop rap', 'soul']",Scream,12eMQUn2GzfsfsQLH53M19,2012,"contemporary r&b, hip hop rnb and dance hall, pop rap, soul"
5JLv62qFIS1DR3zGEcApRt,Wide_Awake_by_Katy_Perry,2012-06-09,Wide Awake,Katy Perry,2,26,"['""ur so fail""', 'also fail', 'american', 'américain', 'bubblegum', 'california gurls', 'chesty', 'cute', 'dance-pop', 'disco', 'electropop', 'fail', 'failfail', 'gaaaaaayyyyyyyyy', 'gaymeme', 'her expression is like shes thinking something dumb', 'homophobe', 'house', ""i'm gay if i am shut up"", ""i'm gay if i am⸲ shut up"", 'katy perry', 'katy perry is gay', 'katy pery is dumb', 'lame', 'lame lame lame lame', 'lolol trap?', 'megafail', 'megalmaestupiddumb', 'multiple ipi', 'nope still fail', 'pop', 'pop rock', 'rock', ""srsly i'm gay if i am shut up"", ""srsly what's wrong with beign gay"", 'still fail', 'total fail', 'trap', 'uncool', 'united states', 'ur so faaaail', 'ur so fail', 'ur so lame', 'usa', ""what's wrong with being gay? gay"", '‟ur so fail”']",Wide Awake,5JLv62qFIS1DR3zGEcApRt,2012,"""ur so fail"", also fail, american, américain, bubblegum, california gurls, chesty, cute, dance-pop, disco, electropop, fail, failfail, gaaaaaayyyyyyyyy, gaymeme, her expression is like shes thinking something dumb, homophobe, house, ""im gay if i am shut up"", ""im gay if i am⸲ shut up"", katy perry, katy perry is gay, katy pery is dumb, lame, lame lame lame lame, lolol trap?, megafail, megalmaestupiddumb, multiple ipi, nope still fail, pop, pop rock, rock, ""srsly im gay if i am shut up"", ""srsly whats wrong with beign gay"", still fail, total fail, trap, uncool, united states, ur so faaaail, ur so fail, ur so lame, usa, ""whats wrong with being gay? gay"", ‟ur so fail”"
4rsW3WCZBGwhHfJWuHRwyT,Home_by_Phillip_Phillips,2012-06-09,Home,Phillip Phillips,6,40,['american idol'],Home,4rsW3WCZBGwhHfJWuHRwyT,2012,american idol
0W4Kpfp1w2xkY3PrV714B7,Ho_Hey_by_The_Lumineers,2012-06-23,Ho Hey,The Lumineers,3,62,"['americana', 'folk pop', 'indie folk', 'indie pop']",Ho Hey,0W4Kpfp1w2xkY3PrV714B7,2012,"americana, folk pop, indie folk, indie pop"
0pwYLVXVknPSGUQb39cePC,As_Long_As_You_Love_Me_by_Justin_Bieber_Featuring_Big_Sean,2012-06-30,As Long As You Love Me,Justin Bieber Featuring Big Sean,6,29,"['amazing', 'awful', 'black metal', 'christmas music', 'contemporary r&b', 'dance-pop', 'electropop', 'english', 'gay', 'pop', 'teen pop', 'terrible', 'tropical house']",As Long As You Love Me,0pwYLVXVknPSGUQb39cePC,2012,"amazing, awful, black metal, christmas music, contemporary r&b, dance-pop, electropop, english, gay, pop, teen pop, terrible, tropical house"
6E11E0lT5Zy7yb6iT3y8DN,Want_U_Back_by_Cher_Lloyd,2012-06-30,Want U Back,Cher Lloyd,12,20,Unknown,Want U Back,6E11E0lT5Zy7yb6iT3y8DN,2012,Unknown
4XNrMwGx1SqP01sqkGTDmo,One_More_Night_by_Maroon_5,2012-07-07,One More Night,Maroon 5,1,42,"['adult contemporary', 'automod ng', 'dance', 'dance-pop', 'electropop', 'fixme label mess', 'funk rock', 'music for soccer moms', 'pop', 'pop rock', 'pop/rock', 'rock', 'rock and indie', 'slow pop']",One More Night,4XNrMwGx1SqP01sqkGTDmo,2012,"adult contemporary, automod ng, dance, dance-pop, electropop, fixme label mess, funk rock, music for soccer moms, pop, pop rock, pop/rock, rock, rock and indie, slow pop"
2o5mwv7hvas1jdUg14Nihv,Take_A_Little_Ride_by_Jason_Aldean,2012-08-04,Take A Little Ride,Jason Aldean,12,20,"['bro-country', 'contemporary country', 'country', 'country pop', 'country rock']",Take A Little Ride,2o5mwv7hvas1jdUg14Nihv,2012,"bro-country, contemporary country, country, country pop, country rock"
4G8gkOterJn0Ywt6uhqbhp,Radioactive_by_Imagine_Dragons,2012-08-18,Radioactive,Imagine Dragons,3,87,"['alternative rock', 'indie pop', 'indietronica', 'pop', 'pop rock', 'rock']",Radioactive,4G8gkOterJn0Ywt6uhqbhp,2012,"alternative rock, indie pop, indietronica, pop, pop rock, rock"
