_uri,id,_date,_song,_artist,_peak-rank,_weeks-on-board,_genres,_track,_uri.1,year,keywords
6eT7xZZlB2mwyzJ2sUKG6w,White_Iverson_by_Post_Malone,2015-09-26,White Iverson,Post Malone,14,30,"['english', 'hip hop']",White Iverson,6eT7xZZlB2mwyzJ2sUKG6w,2015,"english, hip hop"
1BZG99C7Co1r6QUC3zaS59,Same_Old_Love_by_Selena_Gomez,2015-10-03,Same Old Love,Selena Gomez,5,28,"['alternative r&b', 'brostep', 'contemporary r&b', 'dance-pop', 'electro house', 'electro-disco', 'electropop', 'englisch', 'english', 'pop', 'rock', 'teen pop']",Same Old Love,1BZG99C7Co1r6QUC3zaS59,2015,"alternative r&b, brostep, contemporary r&b, dance-pop, electro house, electro-disco, electropop, englisch, english, pop, rock, teen pop"
3NLnwwAQbbFKcEcV8hDItk,Perfect_by_One_Direction,2015-11-07,Perfect,One Direction,10,20,"['boy band', 'dance-pop', 'folk pop', 'pop', 'pop rock', 'power pop']",Perfect,3NLnwwAQbbFKcEcV8hDItk,2015,"boy band, dance-pop, folk pop, pop, pop rock, power pop"
76hfruVvmfQbw0eYn1nmeC,Cake_By_The_Ocean_by_DNCE,2015-11-07,Cake By The Ocean,DNCE,9,46,Unknown,Cake By The Ocean,76hfruVvmfQbw0eYn1nmeC,2015,Unknown
3vv9phIu6Y1vX3jcqaGz5Z,Roses_by_The_Chainsmokers_Featuring_Rozes,2015-11-07,Roses,The Chainsmokers Featuring Rozes,6,31,"['dance-pop', 'edm', 'electro house', 'satire']",Roses,3vv9phIu6Y1vX3jcqaGz5Z,2015,"dance-pop, edm, electro house, satire"
4sPmO7WMQUAf45kwMOtONw,Hello_by_Adele,2015-11-14,Hello,Adele,1,26,"['adele', 'adult alternative pop/rock', 'adult contemporary', 'alternative/indie rock', 'blue eyed soul', 'blue-eyed soul', 'english singer', 'jazz', 'music for soccer moms', 'neo soul', 'pop', 'pop and chart', 'pop soul', 'singer', 'soul']",Hello,4sPmO7WMQUAf45kwMOtONw,2015,"adele, adult alternative pop/rock, adult contemporary, alternative/indie rock, blue eyed soul, blue-eyed soul, english singer, jazz, music for soccer moms, neo soul, pop, pop and chart, pop soul, singer, soul"
6ymzo0FG6EtTW3N9NyeoqQ,Sorry_by_Justin_Bieber,2015-11-14,Sorry,Justin Bieber,1,42,"['amazing', 'awful', 'black metal', 'christmas music', 'contemporary r&b', 'dance-pop', 'electropop', 'english', 'gay', 'pop', 'teen pop', 'terrible', 'tropical house']",Sorry,6ymzo0FG6EtTW3N9NyeoqQ,2015,"amazing, awful, black metal, christmas music, contemporary r&b, dance-pop, electropop, english, gay, pop, teen pop, terrible, tropical house"
1cdzfFjEbUbgTm5nv3FgXR,Focus_by_Ariana_Grande,2015-11-21,Focus,Ariana Grande,7,13,"['ag4', 'contemporary r&b', 'dance-pop', 'electro house', 'electropop', 'english', 'female vocals', 'pop', 'r&b']",Focus,1cdzfFjEbUbgTm5nv3FgXR,2015,"ag4, contemporary r&b, dance-pop, electro house, electropop, english, female vocals, pop, r&b"
6Knv6wdA0luoMUuuoYi2i1,My_House_by_Flo_Rida,2015-11-28,My House,Flo Rida,4,39,"['a filk artist', 'dance-pop', 'electro', 'electropop', 'hip hop', 'hip hop rnb and dance hall', 'hip house', 'pop rap', 'southern hip hop']",My House,6Knv6wdA0luoMUuuoYi2i1,2015,"a filk artist, dance-pop, electro, electropop, hip hop, hip hop rnb and dance hall, hip house, pop rap, southern hip hop"
69uxyAqqPIsUyTO8txoP2M,Adventure_Of_A_Lifetime_by_Coldplay,2015-11-28,Adventure Of A Lifetime,Coldplay,13,20,"['alternative rock', 'ambient pop', 'britannique', 'british', 'britpop', 'chapel', 'english', 'parlophone', 'piano pop', 'piano rock', 'pop', 'pop rock', 'pop/rock', 'post-britpop', 'rock', 'rock and indie', 'uk']",Adventure Of A Lifetime,69uxyAqqPIsUyTO8txoP2M,2015,"alternative rock, ambient pop, britannique, british, britpop, chapel, english, parlophone, piano pop, piano rock, pop, pop rock, pop/rock, post-britpop, rock, rock and indie, uk"
5SlE0MZyLHZwUMvGROYJRl,Love_Yourself_by_Justin_Bieber,2015-12-05,Love Yourself,Justin Bieber,1,41,"['amazing', 'awful', 'black metal', 'christmas music', 'contemporary r&b', 'dance-pop', 'electropop', 'english', 'gay', 'pop', 'teen pop', 'terrible', 'tropical house']",Love Yourself,5SlE0MZyLHZwUMvGROYJRl,2015,"amazing, awful, black metal, christmas music, contemporary r&b, dance-pop, electropop, english, gay, pop, teen pop, terrible, tropical house"
7IWkJwX9C0J7tHurTD7ViL,When_We_Were_Young_by_Adele,2015-12-12,When We Were Young,Adele,14,20,"['adele', 'adult alternative pop/rock', 'adult contemporary', 'alternative/indie rock', 'blue eyed soul', 'blue-eyed soul', 'english singer', 'jazz', 'music for soccer moms', 'neo soul', 'pop', 'pop and chart', 'pop soul', 'singer', 'soul']",When We Were Young,7IWkJwX9C0J7tHurTD7ViL,2015,"adele, adult alternative pop/rock, adult contemporary, alternative/indie rock, blue eyed soul, blue-eyed soul, english singer, jazz, music for soccer moms, neo soul, pop, pop and chart, pop soul, singer, soul"
7soJgKhQTO8hLP2JPRkL5O,One_Call_Away_by_Charlie_Puth,2015-12-19,One Call Away,Charlie Puth,12,26,"['pop', 'pop soul']",One Call Away,7soJgKhQTO8hLP2JPRkL5O,2015,"pop, pop soul"
1LoriJC05IrHIDwj3q0KC1,Hands_To_Myself_by_Selena_Gomez,2015-12-26,Hands To Myself,Selena Gomez,7,20,"['alternative r&b', 'brostep', 'contemporary r&b', 'dance-pop', 'electro house', 'electro-disco', 'electropop', 'englisch', 'english', 'pop', 'rock', 'teen pop']",Hands To Myself,1LoriJC05IrHIDwj3q0KC1,2015,"alternative r&b, brostep, contemporary r&b, dance-pop, electro house, electro-disco, electropop, englisch, english, pop, rock, teen pop"
1MtUq6Wp1eQ8PC6BbPCj8P,I_Took_A_Pill_In_Ibiza_by_Mike_Posner,2016-02-06,I Took A Pill In Ibiza,Mike Posner,4,37,"['club/dance', 'contemporary r&b', 'cover', 'dance-pop', 'electropop', 'folk pop', 'pop']",I Took A Pill In Ibiza,1MtUq6Wp1eQ8PC6BbPCj8P,2016,"club/dance, contemporary r&b, cover, dance-pop, electropop, folk pop, pop"
5kqIPrATaCc2LqxVWzQGbk,7_Years_by_Lukas_Graham,2016-02-06,7 Years,Lukas Graham,2,36,"['lukas graham', 'pop soul', 'soul']",7 Years,5kqIPrATaCc2LqxVWzQGbk,2016,"lukas graham, pop soul, soul"
72TFWvU3wUYdUuxejTTIzt,Work_by_Rihanna_Featuring_Drake,2016-02-13,Work,Rihanna Featuring Drake,1,36,"['barbade', 'barbadian', 'barbadien', 'barbados', 'contemporary r b', 'contemporary r&b', 'dance', 'dance-pop', 'dancehall', 'electro house', 'electropop', 'hip hop', 'pop', 'pop and chart', 'pop soul', 'r&b', 'reggae', 'rehab', 'rihanna', 'rnb']",Work,72TFWvU3wUYdUuxejTTIzt,2016,"barbade, barbadian, barbadien, barbados, contemporary r b, contemporary r&b, dance, dance-pop, dancehall, electro house, electropop, hip hop, pop, pop and chart, pop soul, r&b, reggae, rehab, rihanna, rnb"
0PDUDa38GO8lMxLCRc4lL1,Pillowtalk_by_Zayn,2016-02-20,Pillowtalk,Zayn,1,24,['pop'],Pillowtalk,0PDUDa38GO8lMxLCRc4lL1,2016,pop
17Q87zeXgsAi9iQQbMu9v0,Summer_Sixteen_by_Drake,2016-02-20,Summer Sixteen,Drake,6,14,"['alternative r&b', 'contemporary r&b', 'cotm candidate', 'hardcore hip', 'hip hop', 'lesbian', 'luxury rap', 'pop rap', 'r&b', 'rap', 'rap us', 'rapper', 'relic inn', 'trap', 'trap rap']",Summer Sixteen,17Q87zeXgsAi9iQQbMu9v0,2016,"alternative r&b, contemporary r&b, cotm candidate, hardcore hip, hip hop, lesbian, luxury rap, pop rap, r&b, rap, rap us, rapper, relic inn, trap, trap rap"
4pAl7FkDMNBsjykPXo91B3,Needed_Me_by_Rihanna,2016-02-20,Needed Me,Rihanna,7,45,"['barbade', 'barbadian', 'barbadien', 'barbados', 'contemporary r b', 'contemporary r&b', 'dance', 'dance-pop', 'dancehall', 'electro house', 'electropop', 'hip hop', 'pop', 'pop and chart', 'pop soul', 'r&b', 'reggae', 'rehab', 'rihanna', 'rnb']",Needed Me,4pAl7FkDMNBsjykPXo91B3,2016,"barbade, barbadian, barbadien, barbados, contemporary r b, contemporary r&b, dance, dance-pop, dancehall, electro house, electropop, hip hop, pop, pop and chart, pop soul, r&b, reggae, rehab, rihanna, rnb"
3S4px9f4lceWdKf0gWciFu,Cheap_Thrills_by_Sia_Featuring_Sean_Paul,2016-03-05,Cheap Thrills,Sia Featuring Sean Paul,1,52,"['acid jazz', 'australian', 'chamber pop', 'dance-pop', 'downtempo', 'electropop', 'english', 'indie pop', 'mbs-333', 'pop', 'pop and chart', 'trainwreck']",Cheap Thrills,3S4px9f4lceWdKf0gWciFu,2016,"acid jazz, australian, chamber pop, dance-pop, downtempo, electropop, english, indie pop, mbs-333, pop, pop and chart, trainwreck"
275a9yzwGB6ncAW4SxY7q3,Panda_by_Desiigner,2016-03-12,Panda,Desiigner,1,40,"['east coast hip hop', 'hip hop', 'pop rap', 'trap rap']",Panda,275a9yzwGB6ncAW4SxY7q3,2016,"east coast hip hop, hip hop, pop rap, trap rap"
3KbFtYPyVP6C7BQVgH2cCf,Piece_By_Piece_by_Kelly_Clarkson,2016-03-19,Piece By Piece,Kelly Clarkson,8,15,"['a filk artist', 'american idol', 'dance-pop', 'electropop', 'fixme label mess', 'music for soccer moms', 'pop', 'pop and chart', 'pop rock', 'rock', 'teen pop']",Piece By Piece,3KbFtYPyVP6C7BQVgH2cCf,2016,"a filk artist, american idol, dance-pop, electropop, fixme label mess, music for soccer moms, pop, pop and chart, pop rock, rock, teen pop"
7fCNUWi6uflDTQ08srxMZk,No_by_Meghan_Trainor,2016-03-26,No,Meghan Trainor,3,20,"['a filk artist', 'blue-eyed soul', 'dance-pop', 'doo-wop', 'female vocals', 'great songs', 'music for soccer moms', 'pop', 'pop rap', 'pop soul', 'soul', 'top 40']",No,7fCNUWi6uflDTQ08srxMZk,2016,"a filk artist, blue-eyed soul, dance-pop, doo-wop, female vocals, great songs, music for soccer moms, pop, pop rap, pop soul, soul, top 40"
5H7d8isXFW779pCK7lo4KT,Dangerous_Woman_by_Ariana_Grande,2016-04-02,Dangerous Woman,Ariana Grande,8,21,"['ag4', 'contemporary r&b', 'dance-pop', 'electro house', 'electropop', 'english', 'female vocals', 'pop', 'r&b']",Dangerous Woman,5H7d8isXFW779pCK7lo4KT,2016,"ag4, contemporary r&b, dance-pop, electro house, electropop, english, female vocals, pop, r&b"
2Z8WuEywRWYTKe1NybPQEW,Ride_by_twenty_one_pilots,2016-04-02,Ride,twenty one pilots,5,39,"['alternative hip hop', 'alternative rap', 'alternative rock', 'electropop', 'emo', 'hip hop', 'hip-hop', 'hip-hop/rap', 'indie', 'indie pop', 'indie rock', 'pop', 'pop rock', 'rap', 'rap rock', 'rock']",Ride,2Z8WuEywRWYTKe1NybPQEW,2016,"alternative hip hop, alternative rap, alternative rock, electropop, emo, hip hop, hip-hop, hip-hop/rap, indie, indie pop, indie rock, pop, pop rock, rap, rap rock, rock"
3lSDIJ2abCrOdDJ6pshUap,Close_by_Nick_Jonas_Featuring_Tove_Lo,2016-04-16,Close,Nick Jonas Featuring Tove Lo,14,20,"['dance-pop', 'electropop', 'female vocals', 'indie pop', 'pop', 'top 40']",Close,3lSDIJ2abCrOdDJ6pshUap,2016,"dance-pop, electropop, female vocals, indie pop, pop, top 40"
Unknown,Hold_Up_by_Beyonce,2016-05-14,Hold Up,Beyonce,13,14,"['alternative r&b', 'art pop', 'contemporary pop', 'contemporary r&b', 'country', 'dance-pop', 'electropop', 'funk', 'grammy winner', 'hard rock', 'hip hop rnb and dance hall', 'mbs-333', 'moombahton', 'pop', 'pop rap', 'r&b', 'rnb', 'soul']",Unknown,Unknown,2016,"alternative r&b, art pop, contemporary pop, contemporary r&b, country, dance-pop, electropop, funk, grammy winner, hard rock, hip hop rnb and dance hall, mbs-333, moombahton, pop, pop rap, r&b, rnb, soul"
Unknown,Formation_by_Beyonce,2016-05-14,Formation,Beyonce,10,7,"['alternative r&b', 'art pop', 'contemporary pop', 'contemporary r&b', 'country', 'dance-pop', 'electropop', 'funk', 'grammy winner', 'hard rock', 'hip hop rnb and dance hall', 'mbs-333', 'moombahton', 'pop', 'pop rap', 'r&b', 'rnb', 'soul']",Unknown,Unknown,2016,"alternative r&b, art pop, contemporary pop, contemporary r&b, country, dance-pop, electropop, funk, grammy winner, hard rock, hip hop rnb and dance hall, mbs-333, moombahton, pop, pop rap, r&b, rnb, soul"
Unknown,Sorry_by_Beyonce,2016-05-14,Sorry,Beyonce,11,20,"['alternative r&b', 'art pop', 'contemporary pop', 'contemporary r&b', 'country', 'dance-pop', 'electropop', 'funk', 'grammy winner', 'hard rock', 'hip hop rnb and dance hall', 'mbs-333', 'moombahton', 'pop', 'pop rap', 'r&b', 'rnb', 'soul']",Unknown,Unknown,2016,"alternative r&b, art pop, contemporary pop, contemporary r&b, country, dance-pop, electropop, funk, grammy winner, hard rock, hip hop rnb and dance hall, mbs-333, moombahton, pop, pop rap, r&b, rnb, soul"
0azC730Exh71aQlOt9Zj3y,This_Is_What_You_Came_For_by_Calvin_Harris_Featuring_Rihanna,2016-05-21,This Is What You Came For,Calvin Harris Featuring Rihanna,3,32,"['barbade', 'barbadian', 'barbadien', 'barbados', 'contemporary r b', 'contemporary r&b', 'dance', 'dance-pop', 'dancehall', 'electro house', 'electropop', 'hip hop', 'pop', 'pop and chart', 'pop soul', 'r&b', 'reggae', 'rehab', 'rihanna', 'rnb']",This Is What You Came For,0azC730Exh71aQlOt9Zj3y,2016,"barbade, barbadian, barbadien, barbados, contemporary r b, contemporary r&b, dance, dance-pop, dancehall, electro house, electropop, hip hop, pop, pop and chart, pop soul, r&b, reggae, rehab, rihanna, rnb"
3BtuIIrQlkujKPuWF2B85z,Too_Good_by_Drake_Featuring_Rihanna,2016-05-21,Too Good,Drake Featuring Rihanna,14,29,"['barbade', 'barbadian', 'barbadien', 'barbados', 'contemporary r b', 'contemporary r&b', 'dance', 'dance-pop', 'dancehall', 'electro house', 'electropop', 'hip hop', 'pop', 'pop and chart', 'pop soul', 'r&b', 'reggae', 'rehab', 'rihanna', 'rnb']",Too Good,3BtuIIrQlkujKPuWF2B85z,2016,"barbade, barbadian, barbadien, barbados, contemporary r b, contemporary r&b, dance, dance-pop, dancehall, electro house, electropop, hip hop, pop, pop and chart, pop soul, r&b, reggae, rehab, rihanna, rnb"
6rvHjRpnRhzQVeu8I5CqHp,Into_You_by_Ariana_Grande,2016-05-28,Into You,Ariana Grande,13,24,"['ag4', 'contemporary r&b', 'dance-pop', 'electro house', 'electropop', 'english', 'female vocals', 'pop', 'r&b']",Into You,6rvHjRpnRhzQVeu8I5CqHp,2016,"ag4, contemporary r&b, dance-pop, electro house, electropop, english, female vocals, pop, r&b"
3KwwE4sgCzMaKWq6QBebmX,Me_Too_by_Meghan_Trainor,2016-06-04,Me Too,Meghan Trainor,13,20,"['a filk artist', 'blue-eyed soul', 'dance-pop', 'doo-wop', 'female vocals', 'great songs', 'music for soccer moms', 'pop', 'pop rap', 'pop soul', 'soul', 'top 40']",Me Too,3KwwE4sgCzMaKWq6QBebmX,2016,"a filk artist, blue-eyed soul, dance-pop, doo-wop, female vocals, great songs, music for soccer moms, pop, pop rap, pop soul, soul, top 40"
5oO3drDxtziYU2H1X23ZIp,Love_On_The_Brain_by_Rihanna,2016-06-11,Love On The Brain,Rihanna,5,31,"['barbade', 'barbadian', 'barbadien', 'barbados', 'contemporary r b', 'contemporary r&b', 'dance', 'dance-pop', 'dancehall', 'electro house', 'electropop', 'hip hop', 'pop', 'pop and chart', 'pop soul', 'r&b', 'reggae', 'rehab', 'rihanna', 'rnb']",Love On The Brain,5oO3drDxtziYU2H1X23ZIp,2016,"barbade, barbadian, barbadien, barbados, contemporary r b, contemporary r&b, dance, dance-pop, dancehall, electro house, electropop, hip hop, pop, pop and chart, pop soul, r&b, reggae, rehab, rihanna, rnb"
6ZSO7kPn8IMJFymyticbJO,Gold_by_Kiiara,2016-06-11,Gold,Kiiara,13,27,"['alternative r&b', 'glitch pop']",Gold,6ZSO7kPn8IMJFymyticbJO,2016,"alternative r&b, glitch pop"
0Q4xGOtiIoeXzbihBXdVqB,Treat_You_Better_by_Shawn_Mendes,2016-06-25,Treat You Better,Shawn Mendes,6,39,"['english', 'folk pop', 'piano rock', 'pop', 'pop rock', 'pop soul', 'teen pop']",Treat You Better,0Q4xGOtiIoeXzbihBXdVqB,2016,"english, folk pop, piano rock, pop, pop rock, pop soul, teen pop"
4JDZl9nKIAhAhDjw753u4X,For_Free_by_DJ_Khaled_Featuring_Drake,2016-06-25,For Free,DJ Khaled Featuring Drake,13,20,"['conscious hip hop', 'contemporary r&b', 'english', 'gangsta rap', 'hip hop', 'hip hop rnb and dance hall', 'pop rap', 'southern hip hop', 'trap rap']",For Free,4JDZl9nKIAhAhDjw753u4X,2016,"conscious hip hop, contemporary r&b, english, gangsta rap, hip hop, hip hop rnb and dance hall, pop rap, southern hip hop, trap rap"
6i0V12jOa3mr6uu4WYhUBr,Heathens_by_twenty_one_pilots,2016-07-09,Heathens,twenty one pilots,2,39,"['alternative hip hop', 'alternative rap', 'alternative rock', 'electropop', 'emo', 'hip hop', 'hip-hop', 'hip-hop/rap', 'indie', 'indie pop', 'indie rock', 'pop', 'pop rock', 'rap', 'rap rock', 'rock']",Heathens,6i0V12jOa3mr6uu4WYhUBr,2016,"alternative hip hop, alternative rap, alternative rock, electropop, emo, hip hop, hip-hop, hip-hop/rap, indie, indie pop, indie rock, pop, pop rock, rap, rap rock, rock"
1CwNogTShsnsn1C8UhRmYX,Rise_by_Katy_Perry,2016-08-06,Rise,Katy Perry,11,9,"['""ur so fail""', 'also fail', 'american', 'américain', 'bubblegum', 'california gurls', 'chesty', 'cute', 'dance-pop', 'disco', 'electropop', 'fail', 'failfail', 'gaaaaaayyyyyyyyy', 'gaymeme', 'her expression is like shes thinking something dumb', 'homophobe', 'house', ""i'm gay if i am shut up"", ""i'm gay if i am⸲ shut up"", 'katy perry', 'katy perry is gay', 'katy pery is dumb', 'lame', 'lame lame lame lame', 'lolol trap?', 'megafail', 'megalmaestupiddumb', 'multiple ipi', 'nope still fail', 'pop', 'pop rock', 'rock', ""srsly i'm gay if i am shut up"", ""srsly what's wrong with beign gay"", 'still fail', 'total fail', 'trap', 'uncool', 'united states', 'ur so faaaail', 'ur so fail', 'ur so lame', 'usa', ""what's wrong with being gay? gay"", '‟ur so fail”']",Rise,1CwNogTShsnsn1C8UhRmYX,2016,"""ur so fail"", also fail, american, américain, bubblegum, california gurls, chesty, cute, dance-pop, disco, electropop, fail, failfail, gaaaaaayyyyyyyyy, gaymeme, her expression is like shes thinking something dumb, homophobe, house, ""im gay if i am shut up"", ""im gay if i am⸲ shut up"", katy perry, katy perry is gay, katy pery is dumb, lame, lame lame lame lame, lolol trap?, megafail, megalmaestupiddumb, multiple ipi, nope still fail, pop, pop rock, rock, ""srsly im gay if i am shut up"", ""srsly whats wrong with beign gay"", still fail, total fail, trap, uncool, united states, ur so faaaail, ur so fail, ur so lame, usa, ""whats wrong with being gay? gay"", ‟ur so fail”"
7BKLCZ1jbUBVqRi2FVlTVw,Closer_by_The_Chainsmokers_Featuring_Halsey,2016-08-20,Closer,The Chainsmokers Featuring Halsey,1,52,"['dance-pop', 'edm', 'electro house', 'satire']",Closer,7BKLCZ1jbUBVqRi2FVlTVw,2016,"dance-pop, edm, electro house, satire"
0lYBSQXN6rCTvUZvg9S0lU,Let_Me_Love_You_by_DJ_Snake_Featuring_Justin_Bieber,2016-08-27,Let Me Love You,DJ Snake Featuring Justin Bieber,4,33,"['amazing', 'awful', 'black metal', 'christmas music', 'contemporary r&b', 'dance-pop', 'electropop', 'english', 'gay', 'pop', 'teen pop', 'terrible', 'tropical house']",Let Me Love You,0lYBSQXN6rCTvUZvg9S0lU,2016,"amazing, awful, black metal, christmas music, contemporary r&b, dance-pop, electropop, english, gay, pop, teen pop, terrible, tropical house"
0AS63m1wHv9n4VVRizK6Hc,Mercy_by_Shawn_Mendes,2016-09-10,Mercy,Shawn Mendes,15,32,"['english', 'folk pop', 'piano rock', 'pop', 'pop rock', 'pop soul', 'teen pop']",Mercy,0AS63m1wHv9n4VVRizK6Hc,2016,"english, folk pop, piano rock, pop, pop rock, pop soul, teen pop"
0prNGof3XqfTvNDxHonvdK,Scars_To_Your_Beautiful_by_Alessia_Cara,2016-09-17,Scars To Your Beautiful,Alessia Cara,8,43,"['composer', 'contemporary r&b', 'electropop', 'lyricist', 'musician', 'pop', 'r&b', 'soul', 'vocalist']",Scars To Your Beautiful,0prNGof3XqfTvNDxHonvdK,2016,"composer, contemporary r&b, electropop, lyricist, musician, pop, r&b, soul, vocalist"
Unknown,Caroline_by_Amine,2016-09-24,Caroline,Amine,11,28,Unknown,Unknown,Unknown,2016,Unknown
56ZrTFkANjeAMiS14njg4E,Perfect_Illusion_by_Lady_Gaga,2016-10-01,Perfect Illusion,Lady Gaga,15,6,"['american', 'américain', 'art pop', 'britney spears', 'dance', 'dance-pop', 'disco', 'edge of glory', 'electronic', 'electropop', 'gata rahe mera dil', 'pop', 'pop rock', 'saxx dreams', 'server name', 'synth-pop', 'synthpop', 'the fame', 'united states', 'usa']",Perfect Illusion,56ZrTFkANjeAMiS14njg4E,2016,"american, américain, art pop, britney spears, dance, dance-pop, disco, edge of glory, electronic, electropop, gata rahe mera dil, pop, pop rock, saxx dreams, server name, synth-pop, synthpop, the fame, united states, usa"
6fujklziTHa8uoM5OQSfIo,Black_Beatles_by_Rae_Sremmurd_Featuring_Gucci_Mane,2016-10-01,Black Beatles,Rae Sremmurd Featuring Gucci Mane,1,27,['hip hop'],Black Beatles,6fujklziTHa8uoM5OQSfIo,2016,hip hop
7MXVkk9YMctZqd1Srtv4MB,Starboy_by_The_Weeknd_Featuring_Daft_Punk,2016-10-08,Starboy,The Weeknd Featuring Daft Punk,1,30,"['dance and electronica', 'electro house', 'electronic', 'european', 'favourite', 'film score', 'french', 'french house', 'french touch', 'house', 'nu-disco', 'synthpop', 'tech house', 'thomas bangalter', 'vocoder', 'wp musicians']",Starboy,7MXVkk9YMctZqd1Srtv4MB,2016,"dance and electronica, electro house, electronic, european, favourite, film score, french, french house, french touch, house, nu-disco, synthpop, tech house, thomas bangalter, vocoder, wp musicians"
6b8Be6ljOzmkOmFslEb23P,24K_Magic_by_Bruno_Mars,2016-10-29,24K Magic,Bruno Mars,4,41,"['a filk artist', 'contemporary r&b', 'funk', 'music for soccer moms', 'new wave', 'pop', 'pop rock', 'pop soul', 'r&b', 'relic inn', 'rock', 'soul', 'synth funk']",24K Magic,6b8Be6ljOzmkOmFslEb23P,2016,"a filk artist, contemporary r&b, funk, music for soccer moms, new wave, pop, pop rock, pop soul, r&b, relic inn, rock, soul, synth funk"
1A1JdOJwcX9Ca3IN9mwhN6,Million_Reasons_by_Lady_Gaga,2016-10-29,Million Reasons,Lady Gaga,4,20,"['american', 'américain', 'art pop', 'britney spears', 'dance', 'dance-pop', 'disco', 'edge of glory', 'electronic', 'electropop', 'gata rahe mera dil', 'pop', 'pop rock', 'saxx dreams', 'server name', 'synth-pop', 'synthpop', 'the fame', 'united states', 'usa']",Million Reasons,1A1JdOJwcX9Ca3IN9mwhN6,2016,"american, américain, art pop, britney spears, dance, dance-pop, disco, edge of glory, electronic, electropop, gata rahe mera dil, pop, pop rock, saxx dreams, server name, synth-pop, synthpop, the fame, united states, usa"
1PSBzsahR2AKwLJgx8ehBj,Bad_Things_by_Machine_Gun_Kelly_x_Camila_Cabello,2016-11-05,Bad Things,Machine Gun Kelly x Camila Cabello,4,23,"['dance-pop', 'electropop', 'latin pop', 'pop', 'r&b']",Bad Things,1PSBzsahR2AKwLJgx8ehBj,2016,"dance-pop, electropop, latin pop, pop, r&b"
343YBumqHu19cGoGARUTsd,Fake_Love_by_Drake,2016-11-12,Fake Love,Drake,8,25,"['alternative r&b', 'contemporary r&b', 'cotm candidate', 'hardcore hip', 'hip hop', 'lesbian', 'luxury rap', 'pop rap', 'r&b', 'rap', 'rap us', 'rapper', 'relic inn', 'trap', 'trap rap']",Fake Love,343YBumqHu19cGoGARUTsd,2016,"alternative r&b, contemporary r&b, cotm candidate, hardcore hip, hip hop, lesbian, luxury rap, pop rap, r&b, rap, rap us, rapper, relic inn, trap, trap rap"
3V8sM5OOG6YfDuDLa2IIYJ,Used_To_This_by_Future_Featuring_Drake,2016-11-26,Used To This,Future Featuring Drake,14,18,"['alternative r&b', 'contemporary r&b', 'cotm candidate', 'hardcore hip', 'hip hop', 'lesbian', 'luxury rap', 'pop rap', 'r&b', 'rap', 'rap us', 'rapper', 'relic inn', 'trap', 'trap rap']",Used To This,3V8sM5OOG6YfDuDLa2IIYJ,2016,"alternative r&b, contemporary r&b, cotm candidate, hardcore hip, hip hop, lesbian, luxury rap, pop rap, r&b, rap, rap us, rapper, relic inn, trap, trap rap"
0SGkqnVQo9KPytSri1H6cF,Bounce_Back_by_Big_Sean,2016-11-26,Bounce Back,Big Sean,6,28,"['hip hop', 'pop rap']",Bounce Back,0SGkqnVQo9KPytSri1H6cF,2016,"hip hop, pop rap"
4Km5HrUvYTaSUfiSGPJeQR,Bad_And_Boujee_by_Migos_Featuring_Lil_Uzi_Vert,2016-12-03,Bad And Boujee,Migos Featuring Lil Uzi Vert,1,36,['hip hop'],Bad And Boujee,4Km5HrUvYTaSUfiSGPJeQR,2016,hip hop
3dhjNA0jGA8vHBQ1VdD6vV,I_Feel_It_Coming_by_The_Weeknd_Featuring_Daft_Punk,2016-12-10,I Feel It Coming,The Weeknd Featuring Daft Punk,4,26,"['dance and electronica', 'electro house', 'electronic', 'european', 'favourite', 'film score', 'french', 'french house', 'french touch', 'house', 'nu-disco', 'synthpop', 'tech house', 'thomas bangalter', 'vocoder', 'wp musicians']",I Feel It Coming,3dhjNA0jGA8vHBQ1VdD6vV,2016,"dance and electronica, electro house, electronic, european, favourite, film score, french, french house, french touch, house, nu-disco, synthpop, tech house, thomas bangalter, vocoder, wp musicians"
0wXuerDYiBnERgIpbb3JBR,Redbone_by_Childish_Gambino,2016-12-10,Redbone,Childish Gambino,12,44,"['hip hop', 'hiphop', 'pbr&b', 'r&b', 'rap']",Redbone,0wXuerDYiBnERgIpbb3JBR,2016,"hip hop, hiphop, pbr&b, r&b, rap"
3a1lNhkSLSkpJE4MSHpDu9,Congratulations_by_Post_Malone_Featuring_Quavo,2016-12-31,Congratulations,Post Malone Featuring Quavo,8,50,"['english', 'hip hop']",Congratulations,3a1lNhkSLSkpJE4MSHpDu9,2016,"english, hip hop"
Unknown,Feliz_Navidad_by_Jose_Feliciano,2017-01-07,Feliz Navidad,Jose Feliciano,6,19,"['acoustic guitar', 'bolero', 'christmas music', 'folk pop', 'latin', 'latin pop', 'latin soul', 'pop']",Unknown,Unknown,2017,"acoustic guitar, bolero, christmas music, folk pop, latin, latin pop, latin soul, pop"
65Q2mv3UlVi9eO70OpsmSe,A_Holly_Jolly_Christmas_by_Burl_Ives,2017-01-07,A Holly Jolly Christmas,Burl Ives,4,25,"['2008 universal fire victim', 'american', 'classic pop and rock']",A Holly Jolly Christmas,65Q2mv3UlVi9eO70OpsmSe,2017,"2008 universal fire victim, american, classic pop and rock"
2EEeOnHehOozLq4aS0n6SL,iSpy_by_KYLE_Featuring_Lil_Yachty,2017-01-14,iSpy,KYLE Featuring Lil Yachty,4,30,['mumble rapper'],iSpy,2EEeOnHehOozLq4aS0n6SL,2017,mumble rapper
7qiZfU4dY1lWllzX7mPBI3,Shape_Of_You_by_Ed_Sheeran,2017-01-28,Shape Of You,Ed Sheeran,1,59,"['dance-pop', 'ed sheeran does not make sillyname tracks ಠ_ಠ', 'folk', 'folk pop', 'gradually watermelon', 'guitarist', 'music for soccer moms', 'pop', 'pop rap', 'pop soul', 'rapper', 'singer', 'singer-songwriter', 'singer/songwriter', 'uk']",Shape Of You,7qiZfU4dY1lWllzX7mPBI3,2017,"dance-pop, ed sheeran does not make sillyname tracks ಠ_ಠ, folk, folk pop, gradually watermelon, guitarist, music for soccer moms, pop, pop rap, pop soul, rapper, singer, singer-songwriter, singer/songwriter, uk"
