_date,_song,_artist,_peak-rank,_weeks-on-board,_genres,_track,_uri,year,id,keywords
2014-05-24,Chandelier,Sia,8,46,"['acid jazz', 'australian', 'chamber pop', 'dance-pop', 'downtempo', 'electropop', 'english', 'indie pop', 'mbs-333', 'pop', 'pop and chart', 'trainwreck']",Chandelier,spotify:track:2s1sdSqGcKxpPr5lCl7jAV,2014,Chandelier_by_Sia,"acid jazz, australian, chamber pop, dance-pop, downtempo, electropop, english, indie pop, mbs-333, pop, pop and chart, trainwreck"
2014-06-14,Trumpets,Jason Derulo,14,32,"['contemporary r&b', 'dance', 'dance-pop', 'electropop', 'english', 'pop', 'r&b', 'rock']",Trumpets,spotify:track:5KONnBIQ9LqCxyeSPin26k,2014,Trumpets_by_Jason_Derulo,"contemporary r&b, dance, dance-pop, electropop, english, pop, r&b, rock"
2014-06-21,Boom Clap,Charli XCX,8,25,"['ambient house', 'avant-garde pop', 'bubblegum pop', 'dance-pop', 'electroclash', 'electronic', 'electropop', 'glitch', 'hyperpop', 'pc music', 'pop', 'pop punk', 'pop rock', 'synth-pop', 'synthpop', 'trance']",Boom Clap,spotify:track:0Y1MWB026LYxGvhq4EcMiC,2014,Boom_Clap_by_Charli_XCX,"ambient house, avant-garde pop, bubblegum pop, dance-pop, electroclash, electronic, electropop, glitch, hyperpop, pc music, pop, pop punk, pop rock, synth-pop, synthpop, trance"
2014-06-28,Rather Be,Clean Bandit Featuring Jess Glynne,10,31,"['contemporary r&b', 'dance-pop', 'house', 'pop', 'r&b', 'soul', 'uk funky']",Rather Be,spotify:track:3s4U7OHV7gnj42VV72eSZ6,2014,Rather_Be_by_Clean_Bandit_Featuring_Jess_Glynne,"contemporary r&b, dance-pop, house, pop, r&b, soul, uk funky"
2014-07-05,Maps,Maroon 5,6,22,"['adult contemporary', 'automod ng', 'dance', 'dance-pop', 'electropop', 'fixme label mess', 'funk rock', 'music for soccer moms', 'pop', 'pop rock', 'pop/rock', 'rock', 'rock and indie', 'slow pop']",Maps,spotify:track:4gbVRS8gloEluzf0GzDOFc,2014,Maps_by_Maroon_5,"adult contemporary, automod ng, dance, dance-pop, electropop, fixme label mess, funk rock, music for soccer moms, pop, pop rock, pop/rock, rock, rock and indie, slow pop"
2014-07-19,Break Free,Ariana Grande Featuring Zedd,4,22,"['ag4', 'contemporary r&b', 'dance-pop', 'electro house', 'electropop', 'english', 'female vocals', 'pop', 'r&b']",Break Free,spotify:track:1LD1TFK08cFUBPmhi3FRAA,2014,Break_Free_by_Ariana_Grande_Featuring_Zedd,"ag4, contemporary r&b, dance-pop, electro house, electropop, english, female vocals, pop, r&b"
2014-07-19,Black Widow,Iggy Azalea Featuring Rita Ora,3,30,"['a filk artist', 'electropop', 'hip house', 'hyphy', 'pop rap', 'trap rap']",Black Widow,spotify:track:7pNC5ZIKtwUK0ReSpM3P9f,2014,Black_Widow_by_Iggy_Azalea_Featuring_Rita_Ora,"a filk artist, electropop, hip house, hyphy, pop rap, trap rap"
2014-07-26,Dirt,Florida Georgia Line,11,20,"['bro-country', 'country pop']",Dirt,spotify:track:5CXnIPD6rTjszYYQm6fY2P,2014,Dirt_by_Florida_Georgia_Line,"bro-country, country pop"
2014-07-26,All About That Bass,Meghan Trainor,1,47,"['a filk artist', 'blue-eyed soul', 'dance-pop', 'doo-wop', 'female vocals', 'great songs', 'music for soccer moms', 'pop', 'pop rap', 'pop soul', 'soul', 'top 40']",All About That Bass,spotify:track:5jE48hhRu8E6zBDPRSkEq7,2014,All_About_That_Bass_by_Meghan_Trainor,"a filk artist, blue-eyed soul, dance-pop, doo-wop, female vocals, great songs, music for soccer moms, pop, pop rap, pop soul, soul, top 40"
2014-07-26,Cool Kids,Echosmith,13,23,"['indie pop', 'pop rock']",Cool Kids,spotify:track:13P5rwmk2EsoFRIz9UCeh9,2014,Cool_Kids_by_Echosmith,"indie pop, pop rock"
2014-08-16,Hot Boy,Bobby Shmurda,6,25,Unknown,Hot Boy,spotify:track:0rFke7eNFHbGuGJUdRgjB2,2014,Hot_Boy_by_Bobby_Shmurda,Unknown
2014-08-30,Take Me To Church,Hozier,2,41,"['blues', 'blues rock', 'chamber pop', 'folk rock', 'indie rock', 'pop rock', 'pop soul', 'rock', 'singer-songwriter', 'soul']",Take Me To Church,spotify:track:1CS7Sd1u5tWkstBhpssyjP,2014,Take_Me_To_Church_by_Hozier,"blues, blues rock, chamber pop, folk rock, indie rock, pop rock, pop soul, rock, singer-songwriter, soul"
2014-09-06,Shake It Off,Taylor Swift,1,50,"['americana', 'contemporary country', 'country', 'country pop', 'country-pop', 'dance-pop', 'electropop', 'female vocals', 'fixme label mess', 'hp', 'icon', 'pop', 'pop rock', 'relic inn', 'singer-songwriter', 'singer/songwriter', 'taylor-swift', 'teen pop', 'top 40']",Shake It Off,spotify:track:5xTtaWoae3wi06K5WfVUUH,2014,Shake_It_Off_by_Taylor_Swift,"americana, contemporary country, country, country pop, country-pop, dance-pop, electropop, female vocals, fixme label mess, hp, icon, pop, pop rock, relic inn, singer-songwriter, singer/songwriter, taylor-swift, teen pop, top 40"
2014-09-06,Animals,Maroon 5,3,33,"['adult contemporary', 'automod ng', 'dance', 'dance-pop', 'electropop', 'fixme label mess', 'funk rock', 'music for soccer moms', 'pop', 'pop rock', 'pop/rock', 'rock', 'rock and indie', 'slow pop']",Animals,spotify:track:2bL2gyO6kBdLkNSkxXNh6x,2014,Animals_by_Maroon_5,"adult contemporary, automod ng, dance, dance-pop, electropop, fixme label mess, funk rock, music for soccer moms, pop, pop rock, pop/rock, rock, rock and indie, slow pop"
2014-09-27,Centuries,Fall Out Boy,10,34,"['acoustic rock', 'alternative rock', 'emo', 'emo pop', 'emo-pop', 'hardcore punk', 'pop and chart', 'pop punk', 'pop rock', 'post-emo', 'rock']",Centuries,spotify:track:04aAxqtGp5pv12UXAg4pkq,2014,Centuries_by_Fall_Out_Boy,"acoustic rock, alternative rock, emo, emo pop, emo-pop, hardcore punk, pop and chart, pop punk, pop rock, post-emo, rock"
2014-09-27,Jealous,Nick Jonas,7,32,Unknown,Jealous,spotify:track:4lSkNB2fp7roRthqwD7p8k,2014,Jealous_by_Nick_Jonas,Unknown
2014-09-27,Dear Future Husband,Meghan Trainor,14,24,"['a filk artist', 'blue-eyed soul', 'dance-pop', 'doo-wop', 'female vocals', 'great songs', 'music for soccer moms', 'pop', 'pop rap', 'pop soul', 'soul', 'top 40']",Dear Future Husband,spotify:track:3cU2wBxuV6nFiuf6PJZNlC,2014,Dear_Future_Husband_by_Meghan_Trainor,"a filk artist, blue-eyed soul, dance-pop, doo-wop, female vocals, great songs, music for soccer moms, pop, pop rap, pop soul, soul, top 40"
2014-10-11,Tuesday,I LOVE MAKONNEN Featuring Drake,12,22,Unknown,Tuesday,spotify:track:2znzyzlAUc8Z1Ikq9aFOcx,2014,Tuesday_by_I_LOVE_MAKONNEN_Featuring_Drake,Unknown
2014-10-18,Steal My Girl,One Direction,13,18,"['boy band', 'dance-pop', 'folk pop', 'pop', 'pop rock', 'power pop']",Steal My Girl,spotify:track:2Bs4jQEGMycglOfWPBqrVG,2014,Steal_My_Girl_by_One_Direction,"boy band, dance-pop, folk pop, pop, pop rock, power pop"
2014-10-25,Thinking Out Loud,Ed Sheeran,2,58,"['dance-pop', 'ed sheeran does not make sillyname tracks ಠ_ಠ', 'folk', 'folk pop', 'gradually watermelon', 'guitarist', 'music for soccer moms', 'pop', 'pop rap', 'pop soul', 'rapper', 'singer', 'singer-songwriter', 'singer/songwriter', 'uk']",Thinking Out Loud,spotify:track:34gCuhDGsG4bRPIf9bb02f,2014,Thinking_Out_Loud_by_Ed_Sheeran,"dance-pop, ed sheeran does not make sillyname tracks ಠ_ಠ, folk, folk pop, gradually watermelon, guitarist, music for soccer moms, pop, pop rap, pop soul, rapper, singer, singer-songwriter, singer/songwriter, uk"
2014-11-08,Lips Are Movin,Meghan Trainor,4,29,"['a filk artist', 'blue-eyed soul', 'dance-pop', 'doo-wop', 'female vocals', 'great songs', 'music for soccer moms', 'pop', 'pop rap', 'pop soul', 'soul', 'top 40']",Lips Are Movin,spotify:track:6gj08XDlv9Duc2fPOxUmVD,2014,Lips_Are_Movin_by_Meghan_Trainor,"a filk artist, blue-eyed soul, dance-pop, doo-wop, female vocals, great songs, music for soccer moms, pop, pop rap, pop soul, soul, top 40"
2014-11-15,Blank Space,Taylor Swift,1,36,"['americana', 'contemporary country', 'country', 'country pop', 'country-pop', 'dance-pop', 'electropop', 'female vocals', 'fixme label mess', 'hp', 'icon', 'pop', 'pop rock', 'relic inn', 'singer-songwriter', 'singer/songwriter', 'taylor-swift', 'teen pop', 'top 40']",Blank Space,spotify:track:1kHEuJRasudLhjvnbfc4yS,2014,Blank_Space_by_Taylor_Swift,"americana, contemporary country, country, country pop, country-pop, dance-pop, electropop, female vocals, fixme label mess, hp, icon, pop, pop rock, relic inn, singer-songwriter, singer/songwriter, taylor-swift, teen pop, top 40"
2014-11-15,Bad Blood,Taylor Swift Featuring Kendrick Lamar,1,25,"['boom bap', 'conscious hip hop', 'experimental hip hop', 'funk', 'hardcore hip hop', 'hip hop', 'jazz rap', 'neo soul', 'political hip hop', 'pop', 'pop rap', 'rap', 'relic inn', 'west coast hip hop']",Bad Blood,spotify:track:273dCMFseLcVsoSWx59IoE,2014,Bad_Blood_by_Taylor_Swift_Featuring_Kendrick_Lamar,"boom bap, conscious hip hop, experimental hip hop, funk, hardcore hip hop, hip hop, jazz rap, neo soul, political hip hop, pop, pop rap, rap, relic inn, west coast hip hop"
2014-11-15,Wildest Dreams,Taylor Swift,5,27,"['americana', 'contemporary country', 'country', 'country pop', 'country-pop', 'dance-pop', 'electropop', 'female vocals', 'fixme label mess', 'hp', 'icon', 'pop', 'pop rock', 'relic inn', 'singer-songwriter', 'singer/songwriter', 'taylor-swift', 'teen pop', 'top 40']",Wildest Dreams,spotify:track:59HjlYCeBsxdI0fcm3zglw,2014,Wildest_Dreams_by_Taylor_Swift,"americana, contemporary country, country, country pop, country-pop, dance-pop, electropop, female vocals, fixme label mess, hp, icon, pop, pop rock, relic inn, singer-songwriter, singer/songwriter, taylor-swift, teen pop, top 40"
2014-11-15,Style,Taylor Swift,6,32,"['americana', 'contemporary country', 'country', 'country pop', 'country-pop', 'dance-pop', 'electropop', 'female vocals', 'fixme label mess', 'hp', 'icon', 'pop', 'pop rock', 'relic inn', 'singer-songwriter', 'singer/songwriter', 'taylor-swift', 'teen pop', 'top 40']",Style,spotify:track:4lIxdJw6W3Fg4vUIYCB0S5,2014,Style_by_Taylor_Swift,"americana, contemporary country, country, country pop, country-pop, dance-pop, electropop, female vocals, fixme label mess, hp, icon, pop, pop rock, relic inn, singer-songwriter, singer/songwriter, taylor-swift, teen pop, top 40"
2014-11-22,The Heart Wants What It Wants,Selena Gomez,6,20,"['alternative r&b', 'brostep', 'contemporary r&b', 'dance-pop', 'electro house', 'electro-disco', 'electropop', 'englisch', 'english', 'pop', 'rock', 'teen pop']",The Heart Wants What It Wants,spotify:track:6wJwkMo278iWVlWl1XQ4WA,2014,The_Heart_Wants_What_It_Wants_by_Selena_Gomez,"alternative r&b, brostep, contemporary r&b, dance-pop, electro house, electro-disco, electropop, englisch, english, pop, rock, teen pop"
2014-11-22,Shut Up And Dance,WALK THE MOON,4,53,"['indie rock', 'pop rock']",Shut Up And Dance,spotify:track:0kzw2tRyuL9rzipi5ntlIy,2014,Shut_Up_And_Dance_by_WALK_THE_MOON,"indie rock, pop rock"
2014-12-13,The Hanging Tree,James Newton Howard Featuring Jennifer Lawrence,12,17,"['american', 'classical', 'film composer', 'score', 'soundtrack']",The Hanging Tree,spotify:track:416MsJxvxSKY96DCmbJIRs,2014,The_Hanging_Tree_by_James_Newton_Howard_Featuring_Jennifer_Lawrence,"american, classical, film composer, score, soundtrack"
2014-12-13,7/11,Beyonce,13,20,"['alternative r&b', 'art pop', 'contemporary pop', 'contemporary r&b', 'country', 'dance-pop', 'electropop', 'funk', 'grammy winner', 'hard rock', 'hip hop rnb and dance hall', 'mbs-333', 'moombahton', 'pop', 'pop rap', 'r&b', 'rnb', 'soul']",Unknown,Unknown,2014,7_11_by_Beyonce,"alternative r&b, art pop, contemporary pop, contemporary r&b, country, dance-pop, electropop, funk, grammy winner, hard rock, hip hop rnb and dance hall, mbs-333, moombahton, pop, pop rap, r&b, rnb, soul"
2015-01-03,Wasted Love,Matt McAndrew,14,1,Unknown,Unknown,Unknown,2015,Wasted_Love_by_Matt_McAndrew,Unknown
2015-01-31,Sugar,Maroon 5,2,42,"['adult contemporary', 'automod ng', 'dance', 'dance-pop', 'electropop', 'fixme label mess', 'funk rock', 'music for soccer moms', 'pop', 'pop rock', 'pop/rock', 'rock', 'rock and indie', 'slow pop']",Sugar,spotify:track:3ZKUZe1oUDnEUOQkzBJjf6,2015,Sugar_by_Maroon_5,"adult contemporary, automod ng, dance, dance-pop, electropop, fixme label mess, funk rock, music for soccer moms, pop, pop rock, pop/rock, rock, rock and indie, slow pop"
2015-02-07,Worth It,Fifth Harmony Featuring Kid Ink,12,36,"['contemporary r&b', 'dance-pop', 'electropop', 'latin pop', 'pop rap', 'synthpop']",Worth It,spotify:track:41Fflg7qHiVOD6dEPvsCzO,2015,Worth_It_by_Fifth_Harmony_Featuring_Kid_Ink,"contemporary r&b, dance-pop, electropop, latin pop, pop rap, synthpop"
2015-02-07,Somebody,Natalie La Rose Featuring Jeremih,10,26,"['alternative r&b', 'contemporary r&b', 'pop rap', 'soul', 'wonky']",Somebody,spotify:track:7ioiB40H9xKs04QtIso2I3,2015,Somebody_by_Natalie_La_Rose_Featuring_Jeremih,"alternative r&b, contemporary r&b, pop rap, soul, wonky"
2015-02-14,Chains,Nick Jonas,13,20,Unknown,Chains,spotify:track:5Eg4TsPcqNbIjd8ADMZosg,2015,Chains_by_Nick_Jonas,Unknown
2015-02-14,Talking Body,Tove Lo,12,30,"['dance-pop', 'electropop', 'female vocals', 'indie pop', 'pop', 'top 40']",Talking Body,spotify:track:2tpfxAXiI52znho4WE3XFA,2015,Talking_Body_by_Tove_Lo,"dance-pop, electropop, female vocals, indie pop, pop, top 40"
2015-02-21,Lay Me Down,Sam Smith,8,20,"['alternative r&b', 'blue-eyed soul', 'english', 'pop', 'pop soul', 'soul', 'synth funk']",Lay Me Down,spotify:track:64GRDrL1efgXclrhVCeuA0,2015,Lay_Me_Down_by_Sam_Smith,"alternative r&b, blue-eyed soul, english, pop, pop soul, soul, synth funk"
2015-02-28,One Last Time,Ariana Grande,13,20,"['ag4', 'contemporary r&b', 'dance-pop', 'electro house', 'electropop', 'english', 'female vocals', 'pop', 'r&b']",One Last Time,spotify:track:7xoUc6faLbCqZO6fQEYprd,2015,One_Last_Time_by_Ariana_Grande,"ag4, contemporary r&b, dance-pop, electro house, electropop, english, female vocals, pop, r&b"
2015-03-14,Watch Me,Silento,3,51,Unknown,Unknown,Unknown,2015,Watch_Me_by_Silento,Unknown
2015-03-28,Want To Want Me,Jason Derulo,5,35,"['contemporary r&b', 'dance', 'dance-pop', 'electropop', 'english', 'pop', 'r&b', 'rock']",Want To Want Me,spotify:track:7oGZAicScQt96OAW4AruYy,2015,Want_To_Want_Me_by_Jason_Derulo,"contemporary r&b, dance, dance-pop, electropop, english, pop, r&b, rock"
2015-03-28,See You Again,Wiz Khalifa Featuring Charlie Puth,1,52,"['hip hop', 'hip hop rnb and dance hall', 'pop rap', 'rap']",See You Again,spotify:track:2JzZzZUQj3Qff7wapcbKjc,2015,See_You_Again_by_Wiz_Khalifa_Featuring_Charlie_Puth,"hip hop, hip hop rnb and dance hall, pop rap, rap"
2015-05-02,Fight Song,Rachel Platten,6,31,['pop'],Fight Song,spotify:track:37f4ITSlgPX81ad2EvmVQr,2015,Fight_Song_by_Rachel_Platten,pop
2015-05-09,Cheerleader,OMI,1,35,"['afrobeats', 'dance-pop', 'pop reggae', 'tropical house']",Cheerleader,spotify:track:023OVLNzXhX0j7CxswUt6D,2015,Cheerleader_by_OMI,"afrobeats, dance-pop, pop reggae, tropical house"
2015-05-16,Stressed Out,twenty one pilots,2,52,"['alternative hip hop', 'alternative rap', 'alternative rock', 'electropop', 'emo', 'hip hop', 'hip-hop', 'hip-hop/rap', 'indie', 'indie pop', 'indie rock', 'pop', 'pop rock', 'rap', 'rap rock', 'rock']",Stressed Out,spotify:track:3CRDbSIZ4r5MsZ0YwxuEkn,2015,Stressed_Out_by_twenty_one_pilots,"alternative hip hop, alternative rap, alternative rock, electropop, emo, hip hop, hip-hop, hip-hop/rap, indie, indie pop, indie rock, pop, pop rock, rap, rap rock, rock"
2015-05-30,Photograph,Ed Sheeran,10,30,"['dance-pop', 'ed sheeran does not make sillyname tracks ಠ_ಠ', 'folk', 'folk pop', 'gradually watermelon', 'guitarist', 'music for soccer moms', 'pop', 'pop rap', 'pop soul', 'rapper', 'singer', 'singer-songwriter', 'singer/songwriter', 'uk']",Photograph,spotify:track:1HNkqx9Ahdgi1Ixy2xkKkL,2015,Photograph_by_Ed_Sheeran,"dance-pop, ed sheeran does not make sillyname tracks ಠ_ಠ, folk, folk pop, gradually watermelon, guitarist, music for soccer moms, pop, pop rap, pop soul, rapper, singer, singer-songwriter, singer/songwriter, uk"
2015-06-13,The Hills,The Weeknd,1,48,"['alternative r&b', 'contemporary r&b', 'dance-pop', 'pbr&b', 'pop', 'r&b', 'rnb', 'synth-pop']",The Hills,spotify:track:7fBv7CLKzipRk6EC6TWHOB,2015,The_Hills_by_The_Weeknd,"alternative r&b, contemporary r&b, dance-pop, pbr&b, pop, r&b, rnb, synth-pop"
2015-06-13,Stitches,Shawn Mendes,4,52,"['english', 'folk pop', 'piano rock', 'pop', 'pop rock', 'pop soul', 'teen pop']",Stitches,spotify:track:1FwjPW8U3JGeAWpkTrQjF2,2015,Stitches_by_Shawn_Mendes,"english, folk pop, piano rock, pop, pop rock, pop soul, teen pop"
2015-07-18,679,Fetty Wap Featuring Remy Boyz,4,40,"['contemporary r&b', 'hip hop', 'pop rap', 'trap', 'trap rap']",679,spotify:track:5NQbUaeTEOGdD6hHcre0dZ,2015,679_by_Fetty_Wap_Featuring_Remy_Boyz,"contemporary r&b, hip hop, pop rap, trap, trap rap"
2015-07-18,Cool For The Summer,Demi Lovato,11,20,"['alien lives matter', 'dance-pop', 'electropop', 'pop', 'pop rock', 'synthpop', 'teen pop']",Cool For The Summer,spotify:track:2zFF6jG5hQArbzcXz3KUWk,2015,Cool_For_The_Summer_by_Demi_Lovato,"alien lives matter, dance-pop, electropop, pop, pop rock, synthpop, teen pop"
2015-07-18,My Way,Fetty Wap Featuring Monty,7,22,"['contemporary r&b', 'hip hop', 'pop rap', 'trap', 'trap rap']",My Way,spotify:track:1WoOzgvz6CgH4pX6a1RKGp,2015,My_Way_by_Fetty_Wap_Featuring_Monty,"contemporary r&b, hip hop, pop rap, trap, trap rap"
2015-08-22,Drag Me Down,One Direction,3,20,"['boy band', 'dance-pop', 'folk pop', 'pop', 'pop rock', 'power pop']",Drag Me Down,spotify:track:2K87XMYnUMqLcX3zvtAF4G,2015,Drag_Me_Down_by_One_Direction,"boy band, dance-pop, folk pop, pop, pop rock, power pop"
2015-08-22,Here,Alessia Cara,5,34,"['composer', 'contemporary r&b', 'electropop', 'lyricist', 'musician', 'pop', 'r&b', 'soul', 'vocalist']",Here,spotify:track:1wYZZtamWTQAoj8B812uKQ,2015,Here_by_Alessia_Cara,"composer, contemporary r&b, electropop, lyricist, musician, pop, r&b, soul, vocalist"
2015-08-22,Hotline Bling,Drake,2,36,"['alternative r&b', 'contemporary r&b', 'cotm candidate', 'hardcore hip', 'hip hop', 'lesbian', 'luxury rap', 'pop rap', 'r&b', 'rap', 'rap us', 'rapper', 'relic inn', 'trap', 'trap rap']",Hotline Bling,spotify:track:0wwPcA6wtMf6HUMpIRdeP7,2015,Hotline_Bling_by_Drake,"alternative r&b, contemporary r&b, cotm candidate, hardcore hip, hip hop, lesbian, luxury rap, pop rap, r&b, rap, rap us, rapper, relic inn, trap, trap rap"
2015-09-05,Hit The Quan,iLoveMemphis,15,20,Unknown,Hit The Quan,spotify:track:4OjuzM3rTWp3q60mEldNSF,2015,Hit_The_Quan_by_iLoveMemphis,Unknown
2015-09-19,In The Night,The Weeknd,12,20,"['alternative r&b', 'contemporary r&b', 'dance-pop', 'pbr&b', 'pop', 'r&b', 'rnb', 'synth-pop']",In The Night,spotify:track:25KybV9BOUlvcnv7nN3Pyo,2015,In_The_Night_by_The_Weeknd,"alternative r&b, contemporary r&b, dance-pop, pbr&b, pop, r&b, rnb, synth-pop"
2015-09-26,White Iverson,Post Malone,14,30,"['english', 'hip hop']",White Iverson,spotify:track:6eT7xZZlB2mwyzJ2sUKG6w,2015,White_Iverson_by_Post_Malone,"english, hip hop"
2015-10-03,Same Old Love,Selena Gomez,5,28,"['alternative r&b', 'brostep', 'contemporary r&b', 'dance-pop', 'electro house', 'electro-disco', 'electropop', 'englisch', 'english', 'pop', 'rock', 'teen pop']",Same Old Love,spotify:track:1BZG99C7Co1r6QUC3zaS59,2015,Same_Old_Love_by_Selena_Gomez,"alternative r&b, brostep, contemporary r&b, dance-pop, electro house, electro-disco, electropop, englisch, english, pop, rock, teen pop"
2015-11-07,Perfect,One Direction,10,20,"['boy band', 'dance-pop', 'folk pop', 'pop', 'pop rock', 'power pop']",Perfect,spotify:track:3NLnwwAQbbFKcEcV8hDItk,2015,Perfect_by_One_Direction,"boy band, dance-pop, folk pop, pop, pop rock, power pop"
2015-11-07,Cake By The Ocean,DNCE,9,46,Unknown,Cake By The Ocean,spotify:track:76hfruVvmfQbw0eYn1nmeC,2015,Cake_By_The_Ocean_by_DNCE,Unknown
2015-11-07,Roses,The Chainsmokers Featuring Rozes,6,31,"['dance-pop', 'edm', 'electro house', 'satire']",Roses,spotify:track:3vv9phIu6Y1vX3jcqaGz5Z,2015,Roses_by_The_Chainsmokers_Featuring_Rozes,"dance-pop, edm, electro house, satire"
2015-11-14,Hello,Adele,1,26,"['adele', 'adult alternative pop/rock', 'adult contemporary', 'alternative/indie rock', 'blue eyed soul', 'blue-eyed soul', 'english singer', 'jazz', 'music for soccer moms', 'neo soul', 'pop', 'pop and chart', 'pop soul', 'singer', 'soul']",Hello,spotify:track:4sPmO7WMQUAf45kwMOtONw,2015,Hello_by_Adele,"adele, adult alternative pop/rock, adult contemporary, alternative/indie rock, blue eyed soul, blue-eyed soul, english singer, jazz, music for soccer moms, neo soul, pop, pop and chart, pop soul, singer, soul"
2015-11-14,Sorry,Justin Bieber,1,42,"['amazing', 'awful', 'black metal', 'christmas music', 'contemporary r&b', 'dance-pop', 'electropop', 'english', 'gay', 'pop', 'teen pop', 'terrible', 'tropical house']",Sorry,spotify:track:6ymzo0FG6EtTW3N9NyeoqQ,2015,Sorry_by_Justin_Bieber,"amazing, awful, black metal, christmas music, contemporary r&b, dance-pop, electropop, english, gay, pop, teen pop, terrible, tropical house"
2015-11-21,Focus,Ariana Grande,7,13,"['ag4', 'contemporary r&b', 'dance-pop', 'electro house', 'electropop', 'english', 'female vocals', 'pop', 'r&b']",Focus,spotify:track:1cdzfFjEbUbgTm5nv3FgXR,2015,Focus_by_Ariana_Grande,"ag4, contemporary r&b, dance-pop, electro house, electropop, english, female vocals, pop, r&b"
2015-11-28,My House,Flo Rida,4,39,"['a filk artist', 'dance-pop', 'electro', 'electropop', 'hip hop', 'hip hop rnb and dance hall', 'hip house', 'pop rap', 'southern hip hop']",My House,spotify:track:6Knv6wdA0luoMUuuoYi2i1,2015,My_House_by_Flo_Rida,"a filk artist, dance-pop, electro, electropop, hip hop, hip hop rnb and dance hall, hip house, pop rap, southern hip hop"
2015-11-28,Adventure Of A Lifetime,Coldplay,13,20,"['alternative rock', 'ambient pop', 'britannique', 'british', 'britpop', 'chapel', 'english', 'parlophone', 'piano pop', 'piano rock', 'pop', 'pop rock', 'pop/rock', 'post-britpop', 'rock', 'rock and indie', 'uk']",Adventure Of A Lifetime,spotify:track:69uxyAqqPIsUyTO8txoP2M,2015,Adventure_Of_A_Lifetime_by_Coldplay,"alternative rock, ambient pop, britannique, british, britpop, chapel, english, parlophone, piano pop, piano rock, pop, pop rock, pop/rock, post-britpop, rock, rock and indie, uk"
2015-12-05,Love Yourself,Justin Bieber,1,41,"['amazing', 'awful', 'black metal', 'christmas music', 'contemporary r&b', 'dance-pop', 'electropop', 'english', 'gay', 'pop', 'teen pop', 'terrible', 'tropical house']",Love Yourself,spotify:track:5SlE0MZyLHZwUMvGROYJRl,2015,Love_Yourself_by_Justin_Bieber,"amazing, awful, black metal, christmas music, contemporary r&b, dance-pop, electropop, english, gay, pop, teen pop, terrible, tropical house"
2015-12-12,When We Were Young,Adele,14,20,"['adele', 'adult alternative pop/rock', 'adult contemporary', 'alternative/indie rock', 'blue eyed soul', 'blue-eyed soul', 'english singer', 'jazz', 'music for soccer moms', 'neo soul', 'pop', 'pop and chart', 'pop soul', 'singer', 'soul']",When We Were Young,spotify:track:7IWkJwX9C0J7tHurTD7ViL,2015,When_We_Were_Young_by_Adele,"adele, adult alternative pop/rock, adult contemporary, alternative/indie rock, blue eyed soul, blue-eyed soul, english singer, jazz, music for soccer moms, neo soul, pop, pop and chart, pop soul, singer, soul"
2015-12-19,One Call Away,Charlie Puth,12,26,"['pop', 'pop soul']",One Call Away,spotify:track:7soJgKhQTO8hLP2JPRkL5O,2015,One_Call_Away_by_Charlie_Puth,"pop, pop soul"
2015-12-26,Hands To Myself,Selena Gomez,7,20,"['alternative r&b', 'brostep', 'contemporary r&b', 'dance-pop', 'electro house', 'electro-disco', 'electropop', 'englisch', 'english', 'pop', 'rock', 'teen pop']",Hands To Myself,spotify:track:1LoriJC05IrHIDwj3q0KC1,2015,Hands_To_Myself_by_Selena_Gomez,"alternative r&b, brostep, contemporary r&b, dance-pop, electro house, electro-disco, electropop, englisch, english, pop, rock, teen pop"
2016-02-06,I Took A Pill In Ibiza,Mike Posner,4,37,"['club/dance', 'contemporary r&b', 'cover', 'dance-pop', 'electropop', 'folk pop', 'pop']",I Took A Pill In Ibiza,spotify:track:1MtUq6Wp1eQ8PC6BbPCj8P,2016,I_Took_A_Pill_In_Ibiza_by_Mike_Posner,"club/dance, contemporary r&b, cover, dance-pop, electropop, folk pop, pop"
2016-02-06,7 Years,Lukas Graham,2,36,"['lukas graham', 'pop soul', 'soul']",7 Years,spotify:track:5kqIPrATaCc2LqxVWzQGbk,2016,7_Years_by_Lukas_Graham,"lukas graham, pop soul, soul"
2016-02-13,Work,Rihanna Featuring Drake,1,36,"['barbade', 'barbadian', 'barbadien', 'barbados', 'contemporary r b', 'contemporary r&b', 'dance', 'dance-pop', 'dancehall', 'electro house', 'electropop', 'hip hop', 'pop', 'pop and chart', 'pop soul', 'r&b', 'reggae', 'rehab', 'rihanna', 'rnb']",Work,spotify:track:72TFWvU3wUYdUuxejTTIzt,2016,Work_by_Rihanna_Featuring_Drake,"barbade, barbadian, barbadien, barbados, contemporary r b, contemporary r&b, dance, dance-pop, dancehall, electro house, electropop, hip hop, pop, pop and chart, pop soul, r&b, reggae, rehab, rihanna, rnb"
2016-02-20,Pillowtalk,Zayn,1,24,['pop'],Pillowtalk,spotify:track:0PDUDa38GO8lMxLCRc4lL1,2016,Pillowtalk_by_Zayn,pop
2016-02-20,Summer Sixteen,Drake,6,14,"['alternative r&b', 'contemporary r&b', 'cotm candidate', 'hardcore hip', 'hip hop', 'lesbian', 'luxury rap', 'pop rap', 'r&b', 'rap', 'rap us', 'rapper', 'relic inn', 'trap', 'trap rap']",Summer Sixteen,spotify:track:17Q87zeXgsAi9iQQbMu9v0,2016,Summer_Sixteen_by_Drake,"alternative r&b, contemporary r&b, cotm candidate, hardcore hip, hip hop, lesbian, luxury rap, pop rap, r&b, rap, rap us, rapper, relic inn, trap, trap rap"
2016-02-20,Needed Me,Rihanna,7,45,"['barbade', 'barbadian', 'barbadien', 'barbados', 'contemporary r b', 'contemporary r&b', 'dance', 'dance-pop', 'dancehall', 'electro house', 'electropop', 'hip hop', 'pop', 'pop and chart', 'pop soul', 'r&b', 'reggae', 'rehab', 'rihanna', 'rnb']",Needed Me,spotify:track:4pAl7FkDMNBsjykPXo91B3,2016,Needed_Me_by_Rihanna,"barbade, barbadian, barbadien, barbados, contemporary r b, contemporary r&b, dance, dance-pop, dancehall, electro house, electropop, hip hop, pop, pop and chart, pop soul, r&b, reggae, rehab, rihanna, rnb"
