_date,_song,_artist,_peak-rank,_weeks-on-board,_genres,_track,_uri,year,id,keywords
2006-08-26,Money Maker,Ludacris Featuring Pharrell,1,25,"['american', 'dirty south', 'hip hop', 'hip hop rnb and dance hall', 'hip-hop', 'pop rap', 'rap', 'southern hip hop', 'trap rap']",Money Maker,spotify:track:2JpUkUR0OsOlUUfm6iS8ic,2006,Money_Maker_by_Ludacris_Featuring_Pharrell,"american, dirty south, hip hop, hip hop rnb and dance hall, hip-hop, pop rap, rap, southern hip hop, trap rap"
2006-09-02,Show Stopper,Danity Kane,8,20,Unknown,Show Stopper,spotify:track:5FRIqUXfTazrtRmYEGO4G0,2006,Show_Stopper_by_Danity_Kane,Unknown
2006-09-02,Too Little Too Late,JoJo,3,22,"['jojo', 'pop', 'pop and chart', 'united states']",Too Little Too Late,spotify:track:3hc7PLcmuZbJGPjhIore1i,2006,Too_Little_Too_Late_by_JoJo,"jojo, pop, pop and chart, united states"
2006-09-16,Before He Cheats,Carrie Underwood,8,64,"['american idol', 'contemporary country', 'country', 'country pop', 'country rock', 'pop', 'pop rock']",Before He Cheats,spotify:track:0ZUo4YjG4saFnEJhdWp9Bt,2006,Before_He_Cheats_by_Carrie_Underwood,"american idol, contemporary country, country, country pop, country rock, pop, pop rock"
2006-09-16,Come To Me,Diddy Featuring Nicole Scherzinger,9,20,"['hip hop rnb and dance hall', 'sexy']",Come To Me,spotify:track:6yuvC80FcnVJNvC0DbXN9e,2006,Come_To_Me_by_Diddy_Featuring_Nicole_Scherzinger,"hip hop rnb and dance hall, sexy"
2006-09-23,Ring The Alarm,Beyonce,11,14,"['alternative r&b', 'art pop', 'contemporary pop', 'contemporary r&b', 'country', 'dance-pop', 'electropop', 'funk', 'grammy winner', 'hard rock', 'hip hop rnb and dance hall', 'mbs-333', 'moombahton', 'pop', 'pop rap', 'r&b', 'rnb', 'soul']",Unknown,Unknown,2006,Ring_The_Alarm_by_Beyonce,"alternative r&b, art pop, contemporary pop, contemporary r&b, country, dance-pop, electropop, funk, grammy winner, hard rock, hip hop rnb and dance hall, mbs-333, moombahton, pop, pop rap, r&b, rnb, soul"
2006-09-23,Walk It Out,Unk,10,36,Unknown,Walk It Out,spotify:track:6lSylu4qTmLBGQB1zp5oCi,2006,Walk_It_Out_by_Unk,Unknown
2006-09-30,Welcome To The Black Parade,My Chemical Romance,9,26,"['alternative', 'alternative rock', 'emo', 'hard rock', 'matthew edward hall', 'pop and chart', 'pop punk', 'post-hardcore', 'punk', 'rock']",Welcome To The Black Parade,spotify:track:5wQnmLuC1W7ATsArWACrgW,2006,Welcome_To_The_Black_Parade_by_My_Chemical_Romance,"alternative, alternative rock, emo, hard rock, matthew edward hall, pop and chart, pop punk, post-hardcore, punk, rock"
2006-10-07,Fergalicious,Fergie,2,27,"['contemporary r&b', 'dance-pop', 'electro house', 'hip hop', 'pop', 'pop rap', 'r&b', 'soul and reggae', 'trap']",Fergalicious,spotify:track:1D066zixBwqFYqBhKgdPzp,2006,Fergalicious_by_Fergie,"contemporary r&b, dance-pop, electro house, hip hop, pop, pop rap, r&b, soul and reggae, trap"
2006-10-07,Smack That,Akon Featuring Eminem,2,30,"['2008 universal fire victim', '8 mile', 'american', 'boom bap', 'comedy rap', 'detroit', 'detroit hip hop', 'detroit hip-hop', 'eminem', 'english', 'gangsta rap', 'hardcore hip hop', 'hip hop', 'hip-hop', 'hiphop', 'horrorcore', 'kun', 'midwest hip hop', 'midwest hip-hop', 'pop and chart', 'pop rap', 'rap', 'rapper', 'relic inn', 'turkish', 'us', 'v']",Smack That,spotify:track:2kQuhkFX7uSVepCD3h29g5,2006,Smack_That_by_Akon_Featuring_Eminem,"2008 universal fire victim, 8 mile, american, boom bap, comedy rap, detroit, detroit hip hop, detroit hip-hop, eminem, english, gangsta rap, hardcore hip hop, hip hop, hip-hop, hiphop, horrorcore, kun, midwest hip hop, midwest hip-hop, pop and chart, pop rap, rap, rapper, relic inn, turkish, us, v"
2006-10-14,Rockstar,Nickelback,6,49,"['alternative rock', 'canadian', 'death metal', 'electropop', 'funk rock', 'hard rock', 'music_for_people_who_dislike_music', 'pop and chart', 'pop rock', 'post-grunge', 'rock']",Rockstar,spotify:track:6n9yCXvLhnYMgJIiIcMu7D,2006,Rockstar_by_Nickelback,"alternative rock, canadian, death metal, electropop, funk rock, hard rock, music_for_people_who_dislike_music, pop and chart, pop rock, post-grunge, rock"
2006-10-21,We Fly High,Jim Jones,5,27,"['hip hop', 'hip hop rnb and dance hall']",We Fly High,spotify:track:5rXkgeY6rpcHcsolCpXZHR,2006,We_Fly_High_by_Jim_Jones,"hip hop, hip hop rnb and dance hall"
2006-11-04,Irreplaceable,Beyonce,1,30,"['alternative r&b', 'art pop', 'contemporary pop', 'contemporary r&b', 'country', 'dance-pop', 'electropop', 'funk', 'grammy winner', 'hard rock', 'hip hop rnb and dance hall', 'mbs-333', 'moombahton', 'pop', 'pop rap', 'r&b', 'rnb', 'soul']",Unknown,Unknown,2006,Irreplaceable_by_Beyonce,"alternative r&b, art pop, contemporary pop, contemporary r&b, country, dance-pop, electropop, funk, grammy winner, hard rock, hip hop rnb and dance hall, mbs-333, moombahton, pop, pop rap, r&b, rnb, soul"
2006-11-18,Wind It Up,Gwen Stefani,6,18,"['2008 universal fire victim', 'american', 'contemporary r&b', 'dance-pop', 'electropop', 'new wave', 'no doubt', 'pop', 'pop and chart', 'pop rap', 'pop rock', 'rnb', 'rock', 'ska punk', 'united states']",Wind It Up,spotify:track:1GeECVH4Msg1zLm8DExkbH,2006,Wind_It_Up_by_Gwen_Stefani,"2008 universal fire victim, american, contemporary r&b, dance-pop, electropop, new wave, no doubt, pop, pop and chart, pop rap, pop rock, rnb, rock, ska punk, united states"
2006-11-18,Make It Rain,Fat Joe Featuring Lil Wayne,13,24,"['as jailed', 'chopped and screwed', 'contemporary r&b', 'criminal', 'gangsta rap', 'hip hop', 'hip hop rnb and dance hall', 'lil wayne', 'pop rap', 'r&b', 'rap', 'rap rock', 'relic inn', 'southern hip hop', 'trap']",Make It Rain,spotify:track:1Ji8DhJGIQuV9kBiTgcChh,2006,Make_It_Rain_by_Fat_Joe_Featuring_Lil_Wayne,"as jailed, chopped and screwed, contemporary r&b, criminal, gangsta rap, hip hop, hip hop rnb and dance hall, lil wayne, pop rap, r&b, rap, rap rock, relic inn, southern hip hop, trap"
2006-11-25,Promise,Ciara,11,20,"['contemporary r&b', 'crunk&b', 'dance', 'dance-pop', 'electropop', 'hip hop', 'pop', 'pop and chart', 'pop rap', 'r&b']",Promise,spotify:track:1pLdjo3lOBbMaoR4ZpybFH,2006,Promise_by_Ciara,"contemporary r&b, crunk&b, dance, dance-pop, electropop, hip hop, pop, pop and chart, pop rap, r&b"
2006-11-25,Say It Right,Nelly Furtado,1,30,"['2008 universal fire victim', 'canadian', 'euro/dance-pop', 'folk', 'hip hop', 'hip hop rnb and dance hall', 'pop', 'pop and chart', 'r&b', 'rock']",Say It Right,spotify:track:5AtFypwxB2ShXSxNj12dEd,2006,Say_It_Right_by_Nelly_Furtado,"2008 universal fire victim, canadian, euro/dance-pop, folk, hip hop, hip hop rnb and dance hall, pop, pop and chart, r&b, rock"
2006-11-25,You,Lloyd Featuring Lil Wayne,9,24,"['as jailed', 'chopped and screwed', 'contemporary r&b', 'criminal', 'gangsta rap', 'hip hop', 'hip hop rnb and dance hall', 'lil wayne', 'pop rap', 'r&b', 'rap', 'rap rock', 'relic inn', 'southern hip hop', 'trap']",Unknown,Unknown,2006,You_by_Lloyd_Featuring_Lil_Wayne,"as jailed, chopped and screwed, contemporary r&b, criminal, gangsta rap, hip hop, hip hop rnb and dance hall, lil wayne, pop rap, r&b, rap, rap rock, relic inn, southern hip hop, trap"
2006-12-02,I Luv It,Young Jeezy,14,15,"['chopped and screwed', 'gangsta rap', 'hip hop', 'hustle', 'hyphy', 'rap', 'southern hip hop', 'trap rap']",I Luv It,spotify:track:7qFxSPDUDMQNGBqTvK4aEj,2006,I_Luv_It_by_Young_Jeezy,"chopped and screwed, gangsta rap, hip hop, hustle, hyphy, rap, southern hip hop, trap rap"
2006-12-16,Ice Box,Omarion,12,21,"['contemporary r&b', 'hip hop', 'r&b', 'soul', 'soul and reggae']",Ice Box,spotify:track:5qhlC4Rzals34zxovrPzKp,2006,Ice_Box_by_Omarion,"contemporary r&b, hip hop, r&b, soul, soul and reggae"
2006-12-23,Lost Without U,Robin Thicke,14,23,"['2008 universal fire victim', 'hip hop', 'hip hop rnb and dance hall', 'r&b', 'robin thicke beautiful', 'soul']",Lost Without U,spotify:track:4V2F0DZrAXOWq9hkwMMG3x,2006,Lost_Without_U_by_Robin_Thicke,"2008 universal fire victim, hip hop, hip hop rnb and dance hall, r&b, robin thicke beautiful, soul"
2006-12-30,The Sweet Escape,Gwen Stefani Featuring Akon,2,40,"['2008 universal fire victim', 'american', 'contemporary r&b', 'dance-pop', 'electropop', 'new wave', 'no doubt', 'pop', 'pop and chart', 'pop rap', 'pop rock', 'rnb', 'rock', 'ska punk', 'united states']",The Sweet Escape,spotify:track:66ZcOcouenzZEnzTJvoFmH,2006,The_Sweet_Escape_by_Gwen_Stefani_Featuring_Akon,"2008 universal fire victim, american, contemporary r&b, dance-pop, electropop, new wave, no doubt, pop, pop and chart, pop rap, pop rock, rnb, rock, ska punk, united states"
2007-01-06,On The Hotline,Pretty Ricky,12,19,"['hip hop', 'hip hop rnb and dance hall', 'rap']",On The Hotline,spotify:track:1zyqZONW985Cs4osz9wlsu,2007,On_The_Hotline_by_Pretty_Ricky,"hip hop, hip hop rnb and dance hall, rap"
2007-01-27,Glamorous,Fergie Featuring Ludacris,1,29,"['american', 'dirty south', 'hip hop', 'hip hop rnb and dance hall', 'hip-hop', 'pop rap', 'rap', 'southern hip hop', 'trap rap']",Glamorous,spotify:track:4KTtYhxFtFL7mBwnjkKfLm,2007,Glamorous_by_Fergie_Featuring_Ludacris,"american, dirty south, hip hop, hip hop rnb and dance hall, hip-hop, pop rap, rap, southern hip hop, trap rap"
2007-02-03,Push It To The Limit,Corbin Bleu,14,5,Unknown,Push It To The Limit,spotify:track:3K01q0jtSNHeqx5gs97HH2,2007,Push_It_To_The_Limit_by_Corbin_Bleu,Unknown
2007-02-03,Last Night,Diddy Featuring Keyshia Cole,10,22,"['hip hop', 'hip hop rnb and dance hall', 'r&b']",Last Night,spotify:track:61u8YHgwacXM9Sm5JOblkp,2007,Last_Night_by_Diddy_Featuring_Keyshia_Cole,"hip hop, hip hop rnb and dance hall, r&b"
2007-03-17,Girlfriend,Avril Lavigne,1,24,"['743219675026', 'alternative rock', 'bubblegum punk', 'dance-pop', 'electropop', 'indie rock', 'mall punk', 'pop', 'pop and chart', 'pop punk', 'pop rock', 'pop/rock', 'post-grunge', 'punk', 'punk rock', 'rock', 'soft rock', 'teen pop', 'teen punk']",Girlfriend,spotify:track:45hOioMDJktr86iKDHC8gr,2007,Girlfriend_by_Avril_Lavigne,"743219675026, alternative rock, bubblegum punk, dance-pop, electropop, indie rock, mall punk, pop, pop and chart, pop punk, pop rock, pop/rock, post-grunge, punk, punk rock, rock, soft rock, teen pop, teen punk"
2007-03-17,Home,Daughtry,5,37,"['alternative rock', 'hard rock', 'pop and chart', 'rock']",Home,spotify:track:2mobr1UlKjhxDTOVqng3jw,2007,Home_by_Daughtry,"alternative rock, hard rock, pop and chart, rock"
2007-03-24,Teardrops On My Guitar,Taylor Swift,13,48,"['americana', 'contemporary country', 'country', 'country pop', 'country-pop', 'dance-pop', 'electropop', 'female vocals', 'fixme label mess', 'hp', 'icon', 'pop', 'pop rock', 'relic inn', 'singer-songwriter', 'singer/songwriter', 'taylor-swift', 'teen pop', 'top 40']",Teardrops On My Guitar,spotify:track:7snx7w5WZLHovS0xC45ZfP,2007,Teardrops_On_My_Guitar_by_Taylor_Swift,"americana, contemporary country, country, country pop, country-pop, dance-pop, electropop, female vocals, fixme label mess, hp, icon, pop, pop rock, relic inn, singer-songwriter, singer/songwriter, taylor-swift, teen pop, top 40"
2007-03-31,Rehab,Amy Winehouse,9,20,"['27 club', 'blues', 'british', 'contemporary r&b', 'crossover jazz', 'death by overdose', 'english', 'frank', 'i heard love is blind', 'jazz', 'jazz and blues', 'jazz pop', 'neo soul', 'neo-soul', 'pop', 'pop soul', 'r&b', 'rhythm & blues', 'soul', 'uk', 'vocal jazz']",Rehab,spotify:track:1L5tZi0izXsi5Kk5OJf4W0,2007,Rehab_by_Amy_Winehouse,"27 club, blues, british, contemporary r&b, crossover jazz, death by overdose, english, frank, i heard love is blind, jazz, jazz and blues, jazz pop, neo soul, neo-soul, pop, pop soul, r&b, rhythm & blues, soul, uk, vocal jazz"
2007-04-07,Wait For You,Elliott Yamin,13,30,['american idol'],Wait For You,spotify:track:0U969xYNlAyfzi8P1TaO7u,2007,Wait_For_You_by_Elliott_Yamin,american idol
2007-04-21,Makes Me Wonder,Maroon 5,1,26,"['adult contemporary', 'automod ng', 'dance', 'dance-pop', 'electropop', 'fixme label mess', 'funk rock', 'music for soccer moms', 'pop', 'pop rock', 'pop/rock', 'rock', 'rock and indie', 'slow pop']",Makes Me Wonder,spotify:track:1lHXlGlve5Zx8tXLhyjDwM,2007,Makes_Me_Wonder_by_Maroon_5,"adult contemporary, automod ng, dance, dance-pop, electropop, fixme label mess, funk rock, music for soccer moms, pop, pop rock, pop/rock, rock, rock and indie, slow pop"
2007-04-21,Apologize,Timbaland Featuring OneRepublic,2,47,"['folk pop', 'pop', 'pop rock', 'rock', 'rock and indie', 'united states']",Apologize,spotify:track:1NrJYpdAi7uosDRPmSYrsG,2007,Apologize_by_Timbaland_Featuring_OneRepublic,"folk pop, pop, pop rock, rock, rock and indie, united states"
2007-04-28,Summer Love,Justin Timberlake,6,20,"['boogie', 'contemporary r&b', 'dance-pop', 'disco', 'electropop', 'neo soul', 'pop', 'pop and chart', 'r&b', 'synth funk']",Summer Love,spotify:track:1MBM7CyZbwJpVbbZJnHHRg,2007,Summer_Love_by_Justin_Timberlake,"boogie, contemporary r&b, dance-pop, disco, electropop, neo soul, pop, pop and chart, r&b, synth funk"
2007-04-28,Thnks Fr Th Mmrs,Fall Out Boy,11,28,"['acoustic rock', 'alternative rock', 'emo', 'emo pop', 'emo-pop', 'hardcore punk', 'pop and chart', 'pop punk', 'pop rock', 'post-emo', 'rock']",Thnks Fr Th Mmrs,spotify:track:3Zwu2K0Qa5sT6teCCHPShP,2007,Thnks_Fr_Th_Mmrs_by_Fall_Out_Boy,"acoustic rock, alternative rock, emo, emo pop, emo-pop, hardcore punk, pop and chart, pop punk, pop rock, post-emo, rock"
2007-05-05,Party Like A Rockstar,Shop Boyz,2,22,['hip hop'],Party Like A Rockstar,spotify:track:1IYaMVfidzSfvCUZYXhsU1,2007,Party_Like_A_Rockstar_by_Shop_Boyz,hip hop
2007-05-12,Never Again,Kelly Clarkson,8,16,"['a filk artist', 'american idol', 'dance-pop', 'electropop', 'fixme label mess', 'music for soccer moms', 'pop', 'pop and chart', 'pop rock', 'rock', 'teen pop']",Never Again,spotify:track:24y3tSyLdRbpVsKhQrR2oj,2007,Never_Again_by_Kelly_Clarkson,"a filk artist, american idol, dance-pop, electropop, fixme label mess, music for soccer moms, pop, pop and chart, pop rock, rock, teen pop"
2007-06-02,Bubbly,Colbie Caillat,5,47,"['classic pop and rock', 'folk pop', 'pop', 'singer/songwriter']",Bubbly,spotify:track:0rFOs9paloAvEtzwDX1Kmc,2007,Bubbly_by_Colbie_Caillat,"classic pop and rock, folk pop, pop, singer/songwriter"
2007-06-09,This Is My Now,Jordin Sparks,15,4,"['american idol', 'contemporary r&b', 'dance-pop', 'hip hop rnb and dance hall', 'pop']",This Is My Now,spotify:track:6P5mjh3dfcYJ6JoDd4tdWI,2007,This_Is_My_Now_by_Jordin_Sparks,"american idol, contemporary r&b, dance-pop, hip hop rnb and dance hall, pop"
2007-06-09,Beautiful Girls,Sean Kingston,1,22,"['hip hop', 'iswcs pending', 'pop', 'pop and chart', 'r&b', 'rnb']",Beautiful Girls,spotify:track:1hGy2eLcmC8eKx7qr1tOqx,2007,Beautiful_Girls_by_Sean_Kingston,"hip hop, iswcs pending, pop, pop and chart, r&b, rnb"
2007-06-09,Lip Gloss,Lil Mama,10,11,['hip hop rnb and dance hall'],Lip Gloss,spotify:track:1Y4ZdPOOgCUhBcKZOrUFiS,2007,Lip_Gloss_by_Lil_Mama,hip hop rnb and dance hall
2007-06-16,The Way I Are,Timbaland Featuring Keri Hilson,3,38,"['anti vax', 'contemporary r&b', 'electro', 'electropop', 'pop', 'pop rap', 'r&b']",The Way I Are,spotify:track:2bLqfJjuC5syrsgDsZfGmn,2007,The_Way_I_Are_by_Timbaland_Featuring_Keri_Hilson,"anti vax, contemporary r&b, electro, electropop, pop, pop rap, r&b"
2007-06-23,Shut Up And Drive,Rihanna,15,20,"['barbade', 'barbadian', 'barbadien', 'barbados', 'contemporary r b', 'contemporary r&b', 'dance', 'dance-pop', 'dancehall', 'electro house', 'electropop', 'hip hop', 'pop', 'pop and chart', 'pop soul', 'r&b', 'reggae', 'rehab', 'rihanna', 'rnb']",Shut Up And Drive,spotify:track:4Tn2llBm1g0UlWctmgPL8Z,2007,Shut_Up_And_Drive_by_Rihanna,"barbade, barbadian, barbadien, barbados, contemporary r b, contemporary r&b, dance, dance-pop, dancehall, electro house, electropop, hip hop, pop, pop and chart, pop soul, r&b, reggae, rehab, rihanna, rnb"
2007-06-23,A Bay Bay,Hurricane Chris,7,20,['hip hop'],A Bay Bay,spotify:track:6MnFB3qurhmGs1xdjrz5Bg,2007,A_Bay_Bay_by_Hurricane_Chris,hip hop
2007-06-23,Paralyzer,Finger Eleven,6,50,"['alternative metal', 'canadian', 'hard rock', 'metal', 'pop rock', 'post-grunge', 'rock']",Paralyzer,spotify:track:28IEbk5a7twNTbUEvWslUb,2007,Paralyzer_by_Finger_Eleven,"alternative metal, canadian, hard rock, metal, pop rock, post-grunge, rock"
2007-08-04,What Time Is It,High School Musical 2 Cast,6,8,Unknown,Unknown,Unknown,2007,What_Time_Is_It_by_High_School_Musical_2_Cast,Unknown
2007-08-11,Stronger,Kanye West,1,27,"['american', 'electropop', 'english', 'experimental hip hop', 'grammy winner', 'hardcore hip hop', 'hip hop', 'hip hop rnb and dance hall', 'hip-hop', 'luxury rap', 'pop', 'pop rap', 'producer', 'rap', 'rapper', 'relic inn', 'synthpop', 'us']",Stronger,spotify:track:4fzsfWzRhPawzqhX8Qt9F3,2007,Stronger_by_Kanye_West,"american, electropop, english, experimental hip hop, grammy winner, hardcore hip hop, hip hop, hip hop rnb and dance hall, hip-hop, luxury rap, pop, pop rap, producer, rap, rapper, relic inn, synthpop, us"
2007-08-18,Me Love,Sean Kingston,14,18,"['hip hop', 'iswcs pending', 'pop', 'pop and chart', 'r&b', 'rnb']",Me Love,spotify:track:44M8gY48QHhvc6vn5be10N,2007,Me_Love_by_Sean_Kingston,"hip hop, iswcs pending, pop, pop and chart, r&b, rnb"
2007-09-22,Gimme More,Britney Spears,3,20,"['american', 'américain', 'contemporary r&b', 'dance', 'dance-pop', 'electro house', 'electropop', 'if you seek amy', 'pop', 'pop and chart', 'teen pop', 'urban pop', 'usa']",Gimme More,spotify:track:6ic8OlLUNEATToEFU3xmaH,2007,Gimme_More_by_Britney_Spears,"american, américain, contemporary r&b, dance, dance-pop, electro house, electropop, if you seek amy, pop, pop and chart, teen pop, urban pop, usa"
2007-09-22,No One,Alicia Keys,1,39,"['alternative rock', 'american', 'contemporary r&b', 'film soundtrack', 'hip hop rnb and dance hall', 'jazz', 'neo soul', 'neo-soul', 'pianist', 'pop', 'pop rap', 'r&b', 'rnb', 'singer', 'soul']",No One,spotify:track:6IwKcFdiRQZOWeYNhUiWIv,2007,No_One_by_Alicia_Keys,"alternative rock, american, contemporary r&b, film soundtrack, hip hop rnb and dance hall, jazz, neo soul, neo-soul, pianist, pop, pop rap, r&b, rnb, singer, soul"
2007-09-29,1234,Feist,8,15,"['art pop', 'canada', 'canadian', 'canadien', 'chamber pop', 'electronic', 'folk', 'indie', 'indie pop', 'rock and indie', 'singer/songwriter']",1234,spotify:track:2CzWeyC9zlDpIOZPUUKrBW,2007,1234_by_Feist,"art pop, canada, canadian, canadien, chamber pop, electronic, folk, indie, indie pop, rock and indie, singer/songwriter"
2007-10-06,Duffle Bag Boy,Playaz Circle Featuring Lil Wayne,15,20,"['hip hop', 'hip hop rnb and dance hall']",Duffle Bag Boy,spotify:track:09lqmgrszQIGrS5tFlrmhE,2007,Duffle_Bag_Boy_by_Playaz_Circle_Featuring_Lil_Wayne,"hip hop, hip hop rnb and dance hall"
2007-10-13,Hypnotized,Plies Featuring Akon,14,23,"['gangsta rap', 'hip hop', 'pop rap', 'soul and reggae', 'southern hip hop', 'trap rap']",Hypnotized,spotify:track:3LN41NUdHkyNqQhi9gExMm,2007,Hypnotized_by_Plies_Featuring_Akon,"gangsta rap, hip hop, pop rap, soul and reggae, southern hip hop, trap rap"
2007-10-13,Tattoo,Jordin Sparks,8,31,"['american idol', 'contemporary r&b', 'dance-pop', 'hip hop rnb and dance hall', 'pop']",Tattoo,spotify:track:3Ui2jdyxbZQrZohfM0NOgG,2007,Tattoo_by_Jordin_Sparks,"american idol, contemporary r&b, dance-pop, hip hop rnb and dance hall, pop"
2007-10-27,Clumsy,Fergie,5,25,"['contemporary r&b', 'dance-pop', 'electro house', 'hip hop', 'pop', 'pop rap', 'r&b', 'soul and reggae', 'trap']",Clumsy,spotify:track:50xeLNGKmskmYUSINhqvfa,2007,Clumsy_by_Fergie,"contemporary r&b, dance-pop, electro house, hip hop, pop, pop rap, r&b, soul and reggae, trap"
2007-11-03,Love Like This,Natasha Bedingfield Featuring Sean Kingston,11,20,"['british', 'contemporary r b', 'contemporary r&b', 'electropop', 'english', 'pop', 'pop and chart', 'progressive trance', 'soul', 'uk']",Love Like This,spotify:track:49ppqF73rOz5Nyt1paRxIF,2007,Love_Like_This_by_Natasha_Bedingfield_Featuring_Sean_Kingston,"british, contemporary r b, contemporary r&b, electropop, english, pop, pop and chart, progressive trance, soul, uk"
2007-11-17,Love Song,Sara Bareilles,4,41,"['classic pop and rock', 'pop', 'soft rock']",Love Song,spotify:track:4E6cwWJWZw2zWf7VFbH7wf,2007,Love_Song_by_Sara_Bareilles,"classic pop and rock, pop, soft rock"
2007-11-17,Take You There,Sean Kingston,7,25,"['hip hop', 'iswcs pending', 'pop', 'pop and chart', 'r&b', 'rnb']",Take You There,spotify:track:6AdLyvisRKHLAwARaZMGr6,2007,Take_You_There_by_Sean_Kingston,"hip hop, iswcs pending, pop, pop and chart, r&b, rnb"
2007-11-24,Shadow Of The Day,Linkin Park,15,22,"['alt rock', 'alternative metal', 'alternative rock', 'american', 'américain', 'hip hop', 'industrial rock', 'metal', 'new metal', 'nu metal', 'nu-metal', 'pop rock', 'rap metal', 'rap rock', 'rapcore', 'rock', 'rock and indie', 'roxette', 'the greatest', 'united states', 'usa']",Shadow Of The Day,spotify:track:0OYcEfskah1egYHjYRvbg1,2007,Shadow_Of_The_Day_by_Linkin_Park,"alt rock, alternative metal, alternative rock, american, américain, hip hop, industrial rock, metal, new metal, nu metal, nu-metal, pop rock, rap metal, rap rock, rapcore, rock, rock and indie, roxette, the greatest, united states, usa"
2007-12-15,Say,John Mayer,12,28,"['acoustic rock', 'alternative', 'americana', 'blues', 'blues rock', 'folk rock', 'jazz', 'john mayer', 'pop', 'pop rock', 'production music', 'rock', 'singer/songwriter', 'soul']",Say,spotify:track:6wZI4mdT8JwXgkGURnBQiq,2007,Say_by_John_Mayer,"acoustic rock, alternative, americana, blues, blues rock, folk rock, jazz, john mayer, pop, pop rock, production music, rock, singer/songwriter, soul"
2007-12-15,With You,Chris Brown,2,29,"['_blacklist', 'abuser', 'american', 'anti vax', 'contemporary r&b', 'dance', 'dance-pop', 'electro house', 'electropop', 'hip hop', 'hip hop rnb and dance hall', 'hip-hop', 'misogynist', 'pop', 'pop rap', 'r&b', 'relic inn', 'rnb', 'wifebeater', ""ya man ain't me (produced by the.mp3""]",With You,spotify:track:5Lgcn7u07bHuqbOtXkN62u,2007,With_You_by_Chris_Brown,"_blacklist, abuser, american, anti vax, contemporary r&b, dance, dance-pop, electro house, electropop, hip hop, hip hop rnb and dance hall, hip-hop, misogynist, pop, pop rap, r&b, relic inn, rnb, wifebeater, ""ya man aint me (produced by the.mp3"""
2007-12-22,Sorry,Buckcherry,9,24,"['glam metal', 'hard rock']",Sorry,spotify:track:0EbnUc05YEKhZRKgbrZWpq,2007,Sorry_by_Buckcherry,"glam metal, hard rock"
2007-12-22,See You Again,Miley Cyrus,10,27,"['english', 'miley-cyrus', 'pop', 'pop rock', 'power pop', 'rock']",See You Again,spotify:track:0G71WvIkF2K6HViJeFvOcM,2007,See_You_Again_by_Miley_Cyrus,"english, miley-cyrus, pop, pop rock, power pop, rock"
2007-12-29,Stop And Stare,OneRepublic,12,31,"['folk pop', 'pop', 'pop rock', 'rock', 'rock and indie', 'united states']",Stop And Stare,spotify:track:48s0QHJgmiNsth3WEO6U4M,2007,Stop_And_Stare_by_OneRepublic,"folk pop, pop, pop rock, rock, rock and indie, united states"
2007-12-29,Superstar,Lupe Fiasco Featuring Matthew Santos,10,20,"['abstract hip hop', 'alternative hip hop', 'conscious hip hop', 'hip hop', 'hip hop rnb and dance hall', 'hip-hop', 'political hip hop', 'pop rap', 'rapper']",Superstar,spotify:track:7dltD9eEX7X1zk8JJ9BS0e,2007,Superstar_by_Lupe_Fiasco_Featuring_Matthew_Santos,"abstract hip hop, alternative hip hop, conscious hip hop, hip hop, hip hop rnb and dance hall, hip-hop, political hip hop, pop rap, rapper"
2008-01-19,No Air,Jordin Sparks Duet With Chris Brown,3,35,"['american idol', 'contemporary r&b', 'dance-pop', 'hip hop rnb and dance hall', 'pop']",No Air,spotify:track:1jUA4rb6ZCv4gby4YU53xq,2008,No_Air_by_Jordin_Sparks_Duet_With_Chris_Brown,"american idol, contemporary r&b, dance-pop, hip hop rnb and dance hall, pop"
2008-02-09,Pocketful Of Sunshine,Natasha Bedingfield,5,35,"['british', 'contemporary r b', 'contemporary r&b', 'electropop', 'english', 'pop', 'pop and chart', 'progressive trance', 'soul', 'uk']",Pocketful Of Sunshine,spotify:track:1uigwk5hNV84zRd5YQQRTk,2008,Pocketful_Of_Sunshine_by_Natasha_Bedingfield,"british, contemporary r b, contemporary r&b, electropop, english, pop, pop and chart, progressive trance, soul, uk"
2008-02-16,New Soul,Yael Naim,7,19,"['israeli composer', 'rock and indie']",New Soul,spotify:track:476JcJ3TpAuCOlGdCmomGm,2008,New_Soul_by_Yael_Naim,"israeli composer, rock and indie"
2008-03-01,Love In This Club,Usher Featuring Young Jeezy,1,25,"['chopped and screwed', 'gangsta rap', 'hip hop', 'hustle', 'hyphy', 'rap', 'southern hip hop', 'trap rap']",Love In This Club,spotify:track:5j0McHPthKpOXRr3fBq8M0,2008,Love_In_This_Club_by_Usher_Featuring_Young_Jeezy,"chopped and screwed, gangsta rap, hip hop, hustle, hyphy, rap, southern hip hop, trap rap"
2008-03-01,Bleeding Love,Leona Lewis,1,39,"['british', 'contemporary r&b', 'dance-pop', 'electropop', 'english', 'pop', 'pop and chart', 'uk', 'x factor']",Bleeding Love,spotify:track:7wZUrN8oemZfsEd1CGkbXE,2008,Bleeding_Love_by_Leona_Lewis,"british, contemporary r&b, dance-pop, electropop, english, pop, pop and chart, uk, x factor"
2008-03-01,Touch My Body,Mariah Carey,1,20,"['adult contemporary', 'american', 'christmas music', 'contemporary r&b', 'dance-pop', 'english', 'girl', 'pop', 'pop and chart', 'pop soul', 'r&b', 'rnb', 'soul', 'whistle register']",Touch My Body,spotify:track:2H1l4JczUDbiWfQtQElB05,2008,Touch_My_Body_by_Mariah_Carey,"adult contemporary, american, christmas music, contemporary r&b, dance-pop, english, girl, pop, pop and chart, pop soul, r&b, rnb, soul, whistle register"
2008-03-29,Lollipop,Lil Wayne Featuring Static Major,1,28,Unknown,Lollipop,spotify:track:4P7VFiaZb3xrXoqGwZXC3J,2008,Lollipop_by_Lil_Wayne_Featuring_Static_Major,Unknown
2008-03-29,Damaged,Danity Kane,10,22,Unknown,Damaged,spotify:track:4yHFxB8kzzeuNvoouR8N0N,2008,Damaged_by_Danity_Kane,Unknown
